avg_hop_mrr,benchmark_type,engine,error,error_category,hallucination_rate,hop_coverage,hop_recall_at_10,hop_recall_at_5,latency_ms,mrr,ndcg@1,ndcg@10,ndcg@3,ndcg@5,num_results,precision@1,precision@10,precision@3,precision@5,primary_language,primary_repo,query_id,query_text,recall@1,recall@10,recall@3,recall@5,relevant_tokens_returned,run_id,token_efficiency,total_tokens_returned,trace_id
,adversarial,nia,,,,,,,13332.24,,,,,,0,,,,,,,adv085,Pydantic model_json_schema generation,,,,,0,b7692c5d098e,,0,8c83ef72de36
,adversarial,nia,,,,,,,11801.61,,,,,,0,,,,,,,adv086,Pydantic PlainValidator and WrapValidator custom types,,,,,0,b7692c5d098e,,0,56b118ac874b
,adversarial,nia,,,,,,,115399.34,,,,,,0,,,,,,,adv087,Pydantic Field with JSON schema customization,,,,,0,b7692c5d098e,,0,4af30325fc5e
,adversarial,nia,,,,,,,11668.05,,,,,,0,,,,,,,adv089,Pydantic PrivateAttr for non-validated private attributes,,,,,0,b7692c5d098e,,0,419bac4dae52
,adversarial,nia,,,,,,,11184.54,,,,,,0,,,,,,,adv090,Pydantic custom serializer with field_serializer and model_serializer,,,,,0,b7692c5d098e,,0,a1ca3bbb9dcd
,adversarial,nia,,,,,,,12420.24,,,,,,0,,,,,,,adv091,Pydantic discriminated unions with Discriminator,,,,,0,b7692c5d098e,,0,13b09b83197a
,adversarial,nia,,,,,,,2048.78,,,,,,0,,,,,,,adv092,Pydantic validation error formatting and error types,,,,,0,b7692c5d098e,,0,c1cf1e80bc9a
,adversarial,nia,,,,,,,11426.93,,,,,,0,,,,,,,adv093,Pydantic generic models with TypeVar,,,,,0,b7692c5d098e,,0,c7e4d1f8e933
,adversarial,nia,,,,,,,10319.91,,,,,,0,,,,,,,adv094,Pydantic AliasPath and AliasChoices for nested data access,,,,,0,b7692c5d098e,,0,583988e9cf56
,adversarial,nia,,,,,,,13992.91,,,,,,0,,,,,,,adv095,Pydantic model inheritance and field override behavior,,,,,0,b7692c5d098e,,0,407b8241b475
,adversarial,nia,,,,,,,13606.61,,,,,,0,,,,,,,adv096,PyTorch torch.amp.autocast for mixed precision,,,,,0,b7692c5d098e,,0,fba87988f686
,adversarial,nia,,,,,,,9806.25,,,,,,0,,,,,,,adv097,PyTorch nn.Module forward method dispatch,,,,,0,b7692c5d098e,,0,d5b7f922517a
,adversarial,nia,,,,,,,12476.94,,,,,,0,,,,,,,adv098,PyTorch DataLoader worker process management,,,,,0,b7692c5d098e,,0,71c7fd328c21
,adversarial,nia,,,,,,,11446.67,,,,,,0,,,,,,,adv099,PyTorch optimizer.step() with closure for LBFGS,,,,,0,b7692c5d098e,,0,1c39f0123a0f
,adversarial,nia,,,,,,,12223.06,,,,,,0,,,,,,,adv100,PyTorch distributed all_reduce for gradient synchronization,,,,,0,b7692c5d098e,,0,87be847df8aa
,adversarial,context7,,,,,,,3380.70,,,,,,0,,,,,,,adv001,FastAPI request body validation with Pydantic BaseModel,,,,,0,b7692c5d098e,,0,d8b8ce62690c
,adversarial,context7,,,,,,,2684.54,,,,,,0,,,,,,,adv002,HTTP connection timeout handling in HTTPX client,,,,,0,b7692c5d098e,,0,ad624f11e63b
,adversarial,context7,,,,,,,2683.64,,,,,,0,,,,,,,adv003,Pydantic model_dump method implementation,,,,,0,b7692c5d098e,,0,1e1f6872a4f7
,adversarial,context7,,,,,,,2473.05,,,,,,0,,,,,,,adv004,FastAPI WebSocket accept connection implementation,,,,,0,b7692c5d098e,,0,b3cceb80a162
,adversarial,context7,,,,,,,2684.62,,,,,,0,,,,,,,adv005,HTTPX AsyncClient.get implementation for making GET requests,,,,,0,b7692c5d098e,,0,4dfdc633e76c
,adversarial,context7,,,,,,,2549.95,,,,,,0,,,,,,,adv006,Pydantic field_validator decorator for custom validation,,,,,0,b7692c5d098e,,0,207dc2528c55
,adversarial,context7,,,,,,,2580.87,,,,,,0,,,,,,,adv007,FastAPI Depends() dependency injection resolver,,,,,0,b7692c5d098e,,0,8a80786a6298
,adversarial,context7,,,,,,,2684.09,,,,,,0,,,,,,,adv008,HTTPX request authentication with Bearer token,,,,,0,b7692c5d098e,,0,c01c8d4e393f
,adversarial,context7,,,,,,,2673.51,,,,,,0,,,,,,,adv009,Pydantic ConfigDict for model configuration in v2,,,,,0,b7692c5d098e,,0,5facdf14763d
,adversarial,context7,,,,,,,3117.74,,,,,,0,,,,,,,adv010,FastAPI response_model serialization and filtering implementation,,,,,0,b7692c5d098e,,0,24a80ebf85a4
,adversarial,context7,,,,,,,2481.54,,,,,,0,,,,,,,adv011,FastAPI lifespan context manager for startup/shutdown,,,,,0,b7692c5d098e,,0,aaf9e5e93607
,adversarial,context7,,,,,,,2685.44,,,,,,0,,,,,,,adv012,FastAPI APIRouter include with dependencies and tags,,,,,0,b7692c5d098e,,0,138b65e1c7c8
,adversarial,context7,,,,,,,2887.32,,,,,,0,,,,,,,adv013,FastAPI Security dependency with OAuth2 scopes,,,,,0,b7692c5d098e,,0,4f8f45d79264
,adversarial,context7,,,,,,,2479.45,,,,,,0,,,,,,,adv014,FastAPI path operation decorator internals,,,,,0,b7692c5d098e,,0,a3db56415104
,adversarial,context7,,,,,,,2697.40,,,,,,0,,,,,,,adv015,FastAPI Depends resolution order and sub-dependencies,,,,,0,b7692c5d098e,,0,cfbd731a0840
,adversarial,context7,,,,,,,3107.18,,,,,,0,,,,,,,adv016,FastAPI background task execution after response,,,,,0,b7692c5d098e,,0,d10a40c6b88c
,adversarial,context7,,,,,,,2889.07,,,,,,0,,,,,,,adv017,FastAPI TestClient configuration with app overrides,,,,,0,b7692c5d098e,,0,74cbe507027f
,adversarial,context7,,,,,,,3120.01,,,,,,0,,,,,,,adv018,FastAPI JSONResponse with custom status code and headers,,,,,0,b7692c5d098e,,0,26c2e49e09f9
,adversarial,context7,,,,,,,2780.17,,,,,,0,,,,,,,adv019,FastAPI request body with File and Form mixed parameters,,,,,0,b7692c5d098e,,0,6407ed3eff93
,adversarial,context7,,,,,,,2991.36,,,,,,0,,,,,,,adv020,FastAPI exception handler registration and dispatch,,,,,0,b7692c5d098e,,0,9a036498bc4c
,adversarial,context7,,,,,,,2923.14,,,,,,0,,,,,,,adv021,Django QuerySet.filter implementation with Q objects,,,,,0,b7692c5d098e,,0,70c9fb3c4e76
,adversarial,context7,,,,,,,2583.68,,,,,,0,,,,,,,adv022,Django Model.save() with update_fields and force_insert,,,,,0,b7692c5d098e,,0,0715a65f6bb7
,adversarial,context7,,,,,,,2351.16,,,,,,0,,,,,,,adv023,Django middleware CSRF protection implementation,,,,,0,b7692c5d098e,,0,227f00d7c6e6
,adversarial,context7,,,,,,,2528.67,,,,,,0,,,,,,,adv024,Django ORM select_related vs prefetch_related implementation,,,,,0,b7692c5d098e,,0,b94011356e80
,adversarial,context7,,,,,,,2788.04,,,,,,0,,,,,,,adv025,Django URL resolver matching algorithm,,,,,0,b7692c5d098e,,0,1f28e1da6894
,adversarial,context7,,,,,,,3708.68,,,,,,0,,,,,,,adv026,Django template engine rendering with context processors,,,,,0,b7692c5d098e,,0,27cf55001a31
,adversarial,context7,,,,,,,4016.07,,,,,,0,,,,,,,adv027,Django migration operations AddField and AlterField,,,,,0,b7692c5d098e,,0,05d4f35ada82
,adversarial,context7,,,,,,,2377.20,,,,,,0,,,,,,,adv028,Django form field validation with clean methods,,,,,0,b7692c5d098e,,0,7d30b1679a99
,adversarial,context7,,,,,,,2530.81,,,,,,0,,,,,,,adv029,Django cache framework backend implementation,,,,,0,b7692c5d098e,,0,e51b3f612ade
,adversarial,context7,,,,,,,3709.98,,,,,,0,,,,,,,adv030,Django signals post_save implementation and dispatch,,,,,0,b7692c5d098e,,0,333f96710c7a
,adversarial,context7,,,,,,,2890.44,,,,,,0,,,,,,,adv031,Django REST Framework serializer validation with validate_ methods,,,,,0,b7692c5d098e,,0,078570e494ee
,adversarial,context7,,,,,,,2991.08,,,,,,0,,,,,,,adv032,Django admin ModelAdmin changelist_view implementation,,,,,0,b7692c5d098e,,0,bbd534946b6d
,adversarial,context7,,,,,,,2650.85,,,,,,0,,,,,,,adv033,Django class-based view dispatch method,,,,,0,b7692c5d098e,,0,69b95c2b603b
,adversarial,context7,,,,,,,2972.79,,,,,,0,,,,,,,adv034,Django database router for multi-database read replicas,,,,,0,b7692c5d098e,,0,272fcbc088e7
,adversarial,context7,,,,,,,2632.69,,,,,,0,,,,,,,adv035,Django test client login and session handling,,,,,0,b7692c5d098e,,0,81fa9d6cab02
,adversarial,context7,,,,,,,2821.40,,,,,,0,,,,,,,adv036,Django QuerySet aggregate vs annotate implementation,,,,,0,b7692c5d098e,,0,545cd2c21779
,adversarial,context7,,,,,,,2543.50,,,,,,0,,,,,,,adv037,Django GenericForeignKey content type resolution,,,,,0,b7692c5d098e,,0,bf55d1f9533b
,adversarial,context7,,,,,,,2651.03,,,,,,0,,,,,,,adv038,Django management command implementation with add_arguments,,,,,0,b7692c5d098e,,0,689b88d396ba
,adversarial,context7,,,,,,,2620.34,,,,,,0,,,,,,,adv039,Django QuerySet update with F() expressions for atomic updates,,,,,0,b7692c5d098e,,0,10164b4cd8df
,adversarial,context7,,,,,,,3462.76,,,,,,0,,,,,,,adv040,Django password hashing with PBKDF2 and Argon2,,,,,0,b7692c5d098e,,0,130ba1cc2738
,adversarial,context7,,,,,,,2582.99,,,,,,0,,,,,,,adv041,Flask application context and request context implementation,,,,,0,b7692c5d098e,,0,f2b59e1d2333
,adversarial,context7,,,,,,,2683.86,,,,,,0,,,,,,,adv042,Flask Blueprint registration and deferred setup,,,,,0,b7692c5d098e,,0,ff4c04a81303
,adversarial,context7,,,,,,,2991.60,,,,,,0,,,,,,,adv043,Flask url_for reverse URL generation implementation,,,,,0,b7692c5d098e,,0,16cb71ebf91c
,adversarial,context7,,,,,,,2787.40,,,,,,0,,,,,,,adv044,Flask session interface and cookie signing,,,,,0,b7692c5d098e,,0,86e0e4abf644
,adversarial,context7,,,,,,,2710.02,,,,,,0,,,,,,,adv045,Flask error handler lookup and dispatch,,,,,0,b7692c5d098e,,0,a6ed827bbcc6
,adversarial,context7,,,,,,,2518.95,,,,,,0,,,,,,,adv046,Flask Jinja2 environment configuration and custom filters,,,,,0,b7692c5d098e,,0,0db26043fcdd
,adversarial,context7,,,,,,,2588.21,,,,,,0,,,,,,,adv047,Flask before_request and after_request hook execution,,,,,0,b7692c5d098e,,0,e5b0a7d2b9e5
,adversarial,context7,,,,,,,2581.66,,,,,,0,,,,,,,adv048,Flask send_file and send_from_directory implementation,,,,,0,b7692c5d098e,,0,596749cab86d
,adversarial,context7,,,,,,,3399.62,,,,,,0,,,,,,,adv049,Flask CLI command registration with app.cli,,,,,0,b7692c5d098e,,0,a966cbbb6f5d
,adversarial,context7,,,,,,,2480.05,,,,,,0,,,,,,,adv050,Flask config from environment and files,,,,,0,b7692c5d098e,,0,3bc2d2d6f8f5
,adversarial,context7,,,,,,,3402.20,,,,,,0,,,,,,,adv051,Flask g object implementation for request-scoped globals,,,,,0,b7692c5d098e,,0,aa6f20cb1230
,adversarial,context7,,,,,,,2256.96,,,,,,0,,,,,,,adv052,Flask make_response for custom response objects,,,,,0,b7692c5d098e,,0,0822f792d09e
,adversarial,context7,,,,,,,2619.54,,,,,,0,,,,,,,adv053,Flask signal support with blinker,,,,,0,b7692c5d098e,,0,48534c9acd89
,adversarial,context7,,,,,,,2683.71,,,,,,0,,,,,,,adv054,Flask WSGI app __call__ and request dispatch,,,,,0,b7692c5d098e,,0,766de2ddbba0
,adversarial,context7,,,,,,,2317.50,,,,,,0,,,,,,,adv055,Flask JSON provider and custom JSON encoding,,,,,0,b7692c5d098e,,0,6c9a339fa7fb
,adversarial,context7,,,,,,,2589.32,,,,,,0,,,,,,,adv056,SQLAlchemy 2.0 select() statement construction,,,,,0,b7692c5d098e,,0,c6861bd23030
,adversarial,context7,,,,,,,3003.45,,,,,,0,,,,,,,adv057,SQLAlchemy Mapped[] type annotation for ORM columns,,,,,0,b7692c5d098e,,0,92522a9a2e76
,adversarial,context7,,,,,,,2552.36,,,,,,0,,,,,,,adv058,SQLAlchemy async session context manager,,,,,0,b7692c5d098e,,0,18bd6b2723bc
,adversarial,context7,,,,,,,2991.17,,,,,,0,,,,,,,adv059,SQLAlchemy relationship() with lazy loading strategies,,,,,0,b7692c5d098e,,0,ea7ad03c610f
,adversarial,context7,,,,,,,2786.84,,,,,,0,,,,,,,adv060,SQLAlchemy event.listen for session lifecycle events,,,,,0,b7692c5d098e,,0,de48d8ade706
,adversarial,context7,,,,,,,2580.41,,,,,,0,,,,,,,adv061,SQLAlchemy type coercion with TypeDecorator,,,,,0,b7692c5d098e,,0,5a3df5bcfbd6
,adversarial,context7,,,,,,,2460.68,,,,,,0,,,,,,,adv062,SQLAlchemy connection pool implementation and recycling,,,,,0,b7692c5d098e,,0,9aaca2d1ae1b
,adversarial,context7,,,,,,,2582.24,,,,,,0,,,,,,,adv063,SQLAlchemy alembic migration env.py configuration,,,,,0,b7692c5d098e,,0,19a6d525c4df
,adversarial,context7,,,,,,,3196.36,,,,,,0,,,,,,,adv064,SQLAlchemy inspect() for runtime model introspection,,,,,0,b7692c5d098e,,0,7132ba3e251e
,adversarial,context7,,,,,,,2791.07,,,,,,0,,,,,,,adv065,SQLAlchemy hybrid_property for Python+SQL dual expressions,,,,,0,b7692c5d098e,,0,0aa442588f0b
,adversarial,context7,,,,,,,2788.48,,,,,,0,,,,,,,adv066,SQLAlchemy bulk insert performance with insert().values(),,,,,0,b7692c5d098e,,0,20fcf644969b
,adversarial,context7,,,,,,,2555.41,,,,,,0,,,,,,,adv067,SQLAlchemy compile SQL to string for debugging,,,,,0,b7692c5d098e,,0,d67d7ea98ab1
,adversarial,context7,,,,,,,2581.98,,,,,,0,,,,,,,adv068,SQLAlchemy DeclarativeBase metaclass for model registration,,,,,0,b7692c5d098e,,0,f0a1b90b7fca
,adversarial,context7,,,,,,,2580.80,,,,,,0,,,,,,,adv069,SQLAlchemy with_for_update for row-level locking,,,,,0,b7692c5d098e,,0,d1d52ef56dd8
,adversarial,context7,,,,,,,2686.33,,,,,,0,,,,,,,adv070,SQLAlchemy Index and UniqueConstraint definition,,,,,0,b7692c5d098e,,0,978874d7f626
,adversarial,context7,,,,,,,2582.04,,,,,,0,,,,,,,adv071,HTTPX AsyncClient request method dispatching GET/POST,,,,,0,b7692c5d098e,,0,bc49a84ae930
,adversarial,context7,,,,,,,2554.72,,,,,,0,,,,,,,adv072,HTTPX transport layer for connection handling,,,,,0,b7692c5d098e,,0,ac841fd8eb97
,adversarial,context7,,,,,,,2499.15,,,,,,0,,,,,,,adv073,HTTPX URL parsing and construction,,,,,0,b7692c5d098e,,0,c85631f6dab3
,adversarial,context7,,,,,,,3094.32,,,,,,0,,,,,,,adv074,Requests Session.send with prepared request,,,,,0,b7692c5d098e,,0,5a91400f4093
,adversarial,context7,,,,,,,2375.42,,,,,,0,,,,,,,adv075,Requests HTTPAdapter with max_retries and pool_connections,,,,,0,b7692c5d098e,,0,7aa3cb586276
,adversarial,context7,,,,,,,2682.37,,,,,,0,,,,,,,adv076,HTTPX cookie handling and CookieJar implementation,,,,,0,b7692c5d098e,,0,f4b714f58578
,adversarial,context7,,,,,,,2664.76,,,,,,0,,,,,,,adv077,HTTPX response streaming with aiter_bytes and aiter_lines,,,,,0,b7692c5d098e,,0,a946bef2fe0e
,adversarial,context7,,,,,,,2376.74,,,,,,0,,,,,,,adv078,Requests response content decoding and encoding detection,,,,,0,b7692c5d098e,,0,8ebc4203fb30
,adversarial,context7,,,,,,,2746.00,,,,,,0,,,,,,,adv079,HTTPX event hooks for request/response interception,,,,,0,b7692c5d098e,,0,0fd1e1653fcb
,adversarial,context7,,,,,,,2678.17,,,,,,0,,,,,,,adv080,HTTPX proxy configuration and CONNECT tunneling,,,,,0,b7692c5d098e,,0,2a1533478ef5
,adversarial,context7,,,,,,,2335.12,,,,,,0,,,,,,,adv081,Pydantic v2 model_validate for parsing data,,,,,0,b7692c5d098e,,0,3182a6efd253
,adversarial,context7,,,,,,,2582.59,,,,,,0,,,,,,,adv082,Pydantic v2 ConfigDict for model configuration,,,,,0,b7692c5d098e,,0,80696d07e404
,adversarial,context7,,,,,,,2480.15,,,,,,0,,,,,,,adv083,Pydantic TypeAdapter for standalone validation,,,,,0,b7692c5d098e,,0,e8e9c06a3586
,adversarial,context7,,,,,,,2377.27,,,,,,0,,,,,,,adv084,Pydantic computed_field for derived properties,,,,,0,b7692c5d098e,,0,359e1cb88a90
,adversarial,context7,,,,,,,2376.68,,,,,,0,,,,,,,adv085,Pydantic model_json_schema generation,,,,,0,b7692c5d098e,,0,f6b2b6543527
,adversarial,context7,,,,,,,2797.50,,,,,,0,,,,,,,adv086,Pydantic PlainValidator and WrapValidator custom types,,,,,0,b7692c5d098e,,0,56ce0e04afd5
,adversarial,context7,,,,,,,2888.71,,,,,,0,,,,,,,adv087,Pydantic Field with JSON schema customization,,,,,0,b7692c5d098e,,0,4d246025ef72
,adversarial,context7,,,,,,,3171.28,,,,,,0,,,,,,,adv088,Pydantic BaseSettings for environment variable loading,,,,,0,b7692c5d098e,,0,d129cb279531
,adversarial,context7,,,,,,,2495.34,,,,,,0,,,,,,,adv089,Pydantic PrivateAttr for non-validated private attributes,,,,,0,b7692c5d098e,,0,3042bd0b2a23
,adversarial,context7,,,,,,,2889.13,,,,,,0,,,,,,,adv090,Pydantic custom serializer with field_serializer and model_serializer,,,,,0,b7692c5d098e,,0,a7a8b5a1df98
,adversarial,context7,,,,,,,2789.22,,,,,,0,,,,,,,adv091,Pydantic discriminated unions with Discriminator,,,,,0,b7692c5d098e,,0,81531d21d9c4
,adversarial,context7,,,,,,,2906.68,,,,,,0,,,,,,,adv092,Pydantic validation error formatting and error types,,,,,0,b7692c5d098e,,0,9178de657044
,adversarial,context7,,,,,,,3196.53,,,,,,0,,,,,,,adv093,Pydantic generic models with TypeVar,,,,,0,b7692c5d098e,,0,90169364443e
,adversarial,context7,,,,,,,2684.04,,,,,,0,,,,,,,adv094,Pydantic AliasPath and AliasChoices for nested data access,,,,,0,b7692c5d098e,,0,08591daa0d29
,adversarial,context7,,,,,,,2419.98,,,,,,0,,,,,,,adv095,Pydantic model inheritance and field override behavior,,,,,0,b7692c5d098e,,0,ef1177bb822e
,adversarial,context7,,,,,,,3401.81,,,,,,0,,,,,,,adv096,PyTorch torch.amp.autocast for mixed precision,,,,,0,b7692c5d098e,,0,d949c89a8f40
,adversarial,context7,,,,,,,3195.83,,,,,,0,,,,,,,adv097,PyTorch nn.Module forward method dispatch,,,,,0,b7692c5d098e,,0,cd9585025715
,adversarial,context7,,,,,,,2160.31,,,,,,0,,,,,,,adv098,PyTorch DataLoader worker process management,,,,,0,b7692c5d098e,,0,c51f6f4d4a0b
,adversarial,context7,,,,,,,2632.95,,,,,,0,,,,,,,adv099,PyTorch optimizer.step() with closure for LBFGS,,,,,0,b7692c5d098e,,0,d0bb3901e4c6
,adversarial,context7,,,,,,,2788.70,,,,,,0,,,,,,,adv100,PyTorch distributed all_reduce for gradient synchronization,,,,,0,b7692c5d098e,,0,a42960886668
