avg_hop_mrr,benchmark_type,engine,error,error_category,hallucination_rate,hop_coverage,hop_recall_at_10,hop_recall_at_5,latency_ms,mrr,ndcg@1,ndcg@10,ndcg@3,ndcg@5,num_results,precision@1,precision@10,precision@3,precision@5,primary_language,primary_repo,query_id,query_text,recall@1,recall@10,recall@3,recall@5,relevant_tokens_returned,run_id,token_efficiency,total_tokens_returned,trace_id
,code_qa,nia,,,,,,,6486.25,,,,,,0,,,,,,,cq075,How is the status_code argument used in FastAPI Response classes?,,,,,0,b7692c5d098e,,0,c681e4795b34
,code_qa,nia,,,,,,,9409.90,,,,,,0,,,,,,,cq076,How is the mode argument used in Pydantic's model_validate?,,,,,0,b7692c5d098e,,0,b4868eb0996a
,code_qa,nia,,,,,,,11053.47,,,,,,0,,,,,,,cq077,How is the batch_size argument used in torch.utils.data.DataLoader?,,,,,0,b7692c5d098e,,0,79441c64455f
,code_qa,nia,,,,,,,9304.87,,,,,,0,,,,,,,cq078,What is the return type of Django QuerySet.values_list with flat=True?,,,,,0,b7692c5d098e,,0,cca3af942e0f
,code_qa,nia,,,,,,,7210.97,,,,,,0,,,,,,,cq079,What is the return type of Flask's jsonify function?,,,,,0,b7692c5d098e,,0,757f4800b416
,code_qa,nia,,,,,,,10131.09,,,,,,0,,,,,,,cq080,What is the return type of SQLAlchemy Session.execute?,,,,,0,b7692c5d098e,,0,88c610273de2
,code_qa,nia,,,,,,,9876.43,,,,,,0,,,,,,,cq081,What is the return type of requests.Response.json()?,,,,,0,b7692c5d098e,,0,c1cd9776ea90
,code_qa,nia,,,,,,,7503.27,,,,,,0,,,,,,,cq082,What is the return type of pandas DataFrame.describe?,,,,,0,b7692c5d098e,,0,f6c8f2ea1078
,code_qa,nia,,,,,,,9401.19,,,,,,0,,,,,,,cq083,What is the return type of numpy.linalg.svd?,,,,,0,b7692c5d098e,,0,17abfb16cc9c
,code_qa,nia,,,,,,,9868.97,,,,,,0,,,,,,,cq084,What is the return type of torch.nn.Module.parameters()?,,,,,0,b7692c5d098e,,0,dcc698242ca3
,code_qa,nia,,,,,,,11207.96,,,,,,0,,,,,,,cq085,What is the return type of sklearn train_test_split?,,,,,0,b7692c5d098e,,0,f27e376f70c5
,code_qa,nia,,,,,,,15741.65,,,,,,0,,,,,,,cq086,What is the return type of httpx.Response.raise_for_status?,,,,,0,b7692c5d098e,,0,a543f83e11ac
,code_qa,nia,,,,,,,11156.95,,,,,,0,,,,,,,cq087,What is the return type of Celery AsyncResult.get?,,,,,0,b7692c5d098e,,0,4916a4686538
,code_qa,nia,,,,,,,10580.24,,,,,,0,,,,,,,cq088,What is the return type of LangChain's chain.invoke?,,,,,0,b7692c5d098e,,0,cd115640c23b
,code_qa,nia,,,,,,,9612.81,,,,,,0,,,,,,,cq089,What classes inherit from Django's View class?,,,,,0,b7692c5d098e,,0,2605f3c18fba
,code_qa,nia,,,,,,,11442.21,,,,,,0,,,,,,,cq090,What classes inherit from Flask's MethodView?,,,,,0,b7692c5d098e,,0,38a9199c7009
,code_qa,nia,,,,,,,9955.43,,,,,,0,,,,,,,cq091,What classes inherit from SQLAlchemy's TypeDecorator?,,,,,0,b7692c5d098e,,0,84ffb2bae5db
,code_qa,nia,,,,,,,9192.98,,,,,,0,,,,,,,cq092,What classes inherit from torch.nn.Module in the nn package?,,,,,0,b7692c5d098e,,0,1bcfc5715288
,code_qa,nia,,,,,,,12193.95,,,,,,0,,,,,,,cq093,What classes inherit from sklearn's TransformerMixin?,,,,,0,b7692c5d098e,,0,acb2cb864876
,code_qa,nia,,,,,,,7342.81,,,,,,0,,,,,,,cq094,What classes inherit from Pydantic BaseModel in the pydantic package itself?,,,,,0,b7692c5d098e,,0,26aeca2ede68
,code_qa,nia,,,,,,,12788.72,,,,,,0,,,,,,,cq095,What classes inherit from Starlette's HTTPEndpoint?,,,,,0,b7692c5d098e,,0,42c39750bd97
,code_qa,nia,,,,,,,13142.08,,,,,,0,,,,,,,cq096,What classes inherit from aiohttp's AbstractView?,,,,,0,b7692c5d098e,,0,9e343fe44760
,code_qa,nia,,,,,,,9563.95,,,,,,0,,,,,,,cq097,What classes inherit from LangChain's BaseRetriever?,,,,,0,b7692c5d098e,,0,71c26d9eab35
,code_qa,nia,,,,,,,11018.80,,,,,,0,,,,,,,cq099,What classes inherit from Celery's Task base class?,,,,,0,b7692c5d098e,,0,9af0cb9ba49e
,code_qa,nia,,,,,,,96137.85,,,,,,0,,,,,,,cq100,Where is Django's path function imported from in URL configurations?,,,,,0,b7692c5d098e,,0,edd58355fb2e
,code_qa,context7,,,,,,,2822.78,,,,,,0,,,,,,,cq001,Where is the FastAPI class defined and what parameters does its __init__ accept?,,,,,0,b7692c5d098e,,0,f54d0b994e1d
,code_qa,context7,,,,,,,2253.65,,,,,,0,,,,,,,cq002,Where is HTTPException raised with a 404 status code?,,,,,0,b7692c5d098e,,0,2a4ee74dcf92
,code_qa,context7,,,,,,,2275.57,,,,,,0,,,,,,,cq003,What classes inherit from BaseModel in the FastAPI codebase?,,,,,0,b7692c5d098e,,0,fa13f7051e3e
,code_qa,context7,,,,,,,2469.46,,,,,,0,,,,,,,cq004,Where is the Depends function defined and how does it resolve dependencies?,,,,,0,b7692c5d098e,,0,e7dbc11d00e1
,code_qa,context7,,,,,,,3081.56,,,,,,0,,,,,,,cq005,Where is AsyncClient instantiated with http2=True?,,,,,0,b7692c5d098e,,0,b23c5862a635
,code_qa,context7,,,,,,,2276.46,,,,,,0,,,,,,,cq006,What does the field_validator decorator do in Pydantic v2 and where is it defined?,,,,,0,b7692c5d098e,,0,4a97c0b337a1
,code_qa,context7,,,,,,,2776.61,,,,,,0,,,,,,,cq007,Where is the Timeout class used with custom connect and read values?,,,,,0,b7692c5d098e,,0,da673b52a0ec
,code_qa,context7,,,,,,,2784.93,,,,,,0,,,,,,,cq008,What is the return type of the model_dump method in Pydantic BaseModel?,,,,,0,b7692c5d098e,,0,4b85fa3e514f
,code_qa,context7,,,,,,,2786.96,,,,,,0,,,,,,,cq009,Where is jsonable_encoder imported and used in FastAPI?,,,,,0,b7692c5d098e,,0,4a24006264af
,code_qa,context7,,,,,,,2786.73,,,,,,0,,,,,,,cq010,Where is response_model used as a parameter in FastAPI route decorators?,,,,,0,b7692c5d098e,,0,24abe5dc3095
,code_qa,context7,,,,,,,3294.29,,,,,,0,,,,,,,cq011,Where is the Router.add_api_route method defined and what decorators does it support?,,,,,0,b7692c5d098e,,0,6a93c2a20a73
,code_qa,context7,,,,,,,2775.06,,,,,,0,,,,,,,cq012,Where is CORSMiddleware added to the app with allow_credentials=True?,,,,,0,b7692c5d098e,,0,1200a5cf8322
,code_qa,context7,,,,,,,2581.86,,,,,,0,,,,,,,cq013,What is the complete signature of httpx.AsyncClient.__init__?,,,,,0,b7692c5d098e,,0,d3d8fda19676
,code_qa,context7,,,,,,,2852.06,,,,,,0,,,,,,,cq014,Where does Pydantic raise ValidationError and what fields does the error contain?,,,,,0,b7692c5d098e,,0,f01689519e1e
,code_qa,context7,,,,,,,3344.31,,,,,,0,,,,,,,cq015,Where is the @app.on_event startup handler used and what has replaced it in newer FastAPI?,,,,,0,b7692c5d098e,,0,d6bafb811777
,code_qa,context7,,,,,,,3707.54,,,,,,0,,,,,,,cq016,Where is the Django Model class defined and what metaclass does it use?,,,,,0,b7692c5d098e,,0,118a16bfbe5e
,code_qa,context7,,,,,,,2582.74,,,,,,0,,,,,,,cq017,Where is the Flask class constructor defined and what parameters does it accept?,,,,,0,b7692c5d098e,,0,4861fbab7fa4
,code_qa,context7,,,,,,,3298.28,,,,,,0,,,,,,,cq018,Where is the SQLAlchemy create_engine function defined?,,,,,0,b7692c5d098e,,0,cce88bf34b0e
,code_qa,context7,,,,,,,2675.69,,,,,,0,,,,,,,cq019,How is torch.nn.Module.__init__ defined and what does it initialize?,,,,,0,b7692c5d098e,,0,0a96a0b3e5d8
,code_qa,context7,,,,,,,2580.98,,,,,,0,,,,,,,cq020,Where is pandas.DataFrame.__init__ defined and what parameters does it accept?,,,,,0,b7692c5d098e,,0,eace985770b0
,code_qa,context7,,,,,,,2992.50,,,,,,0,,,,,,,cq021,Where is numpy.ndarray defined as a class?,,,,,0,b7692c5d098e,,0,ec9c1dfc1ec8
,code_qa,context7,,,,,,,3195.12,,,,,,0,,,,,,,cq022,Where is the requests.Session class defined and what methods does it expose?,,,,,0,b7692c5d098e,,0,261fca3f3f2d
,code_qa,context7,,,,,,,2775.70,,,,,,0,,,,,,,cq023,Where is the Celery class defined and what does its __init__ accept?,,,,,0,b7692c5d098e,,0,22c02b47fcb7
,code_qa,context7,,,,,,,2992.35,,,,,,0,,,,,,,cq024,Where is the Starlette class defined and how does it differ from FastAPI?,,,,,0,b7692c5d098e,,0,6ce652376de0
,code_qa,context7,,,,,,,2878.94,,,,,,0,,,,,,,cq025,Where is aiohttp.ClientSession defined and what parameters does __init__ accept?,,,,,0,b7692c5d098e,,0,777db3b7d663
,code_qa,context7,,,,,,,2675.77,,,,,,0,,,,,,,cq026,Where is sklearn.base.BaseEstimator defined and what mixin methods does it provide?,,,,,0,b7692c5d098e,,0,2b58d101b9de
,code_qa,context7,,,,,,,4835.14,,,,,,0,,,,,,,cq027,Where is the LangChain BaseLLM class defined?,,,,,0,b7692c5d098e,,0,a05179238f4f
,code_qa,context7,,,,,,,3196.62,,,,,,0,,,,,,,cq028,Where is the Django QuerySet.filter method defined?,,,,,0,b7692c5d098e,,0,acdef0bb6081
,code_qa,context7,,,,,,,2783.44,,,,,,0,,,,,,,cq029,Where is the Flask route decorator defined?,,,,,0,b7692c5d098e,,0,df4f0f688ae4
,code_qa,context7,,,,,,,2787.71,,,,,,0,,,,,,,cq030,Where is SQLAlchemy's Column class defined and what arguments does it accept?,,,,,0,b7692c5d098e,,0,1284bc2085aa
,code_qa,context7,,,,,,,2980.81,,,,,,0,,,,,,,cq031,Where is torch.Tensor defined and what are its core attributes?,,,,,0,b7692c5d098e,,0,e033e02acb75
,code_qa,context7,,,,,,,2684.34,,,,,,0,,,,,,,cq032,Where is the pandas read_csv function defined?,,,,,0,b7692c5d098e,,0,d2679487afaf
,code_qa,context7,,,,,,,2924.10,,,,,,0,,,,,,,cq033,Where is numpy.array function defined?,,,,,0,b7692c5d098e,,0,e643fe6358af
,code_qa,context7,,,,,,,2432.20,,,,,,0,,,,,,,cq034,Where is requests.get defined and what parameters does it accept?,,,,,0,b7692c5d098e,,0,dc0955c2d0bd
,code_qa,context7,,,,,,,2786.02,,,,,,0,,,,,,,cq035,Where is the httpx.Response class defined?,,,,,0,b7692c5d098e,,0,cb31f9212b0d
,code_qa,context7,,,,,,,2621.38,,,,,,0,,,,,,,cq036,Where is the Pydantic ConfigDict defined and what keys does it accept?,,,,,0,b7692c5d098e,,0,18eae092a16b
,code_qa,context7,,,,,,,4016.51,,,,,,0,,,,,,,cq037,Where is the LangChain ChatPromptTemplate class defined?,,,,,0,b7692c5d098e,,0,96110c181a0b
,code_qa,context7,,,,,,,2581.65,,,,,,0,,,,,,,cq038,Where is the Django URLPattern class defined?,,,,,0,b7692c5d098e,,0,0b80940b4a97
,code_qa,context7,,,,,,,3087.28,,,,,,0,,,,,,,cq039,Where is sklearn.pipeline.Pipeline defined and what does __init__ accept?,,,,,0,b7692c5d098e,,0,941da11c2b19
,code_qa,context7,,,,,,,2981.26,,,,,,0,,,,,,,cq040,Where is the Celery task decorator defined?,,,,,0,b7692c5d098e,,0,1553cdba60ad
,code_qa,context7,,,,,,,2581.48,,,,,,0,,,,,,,cq041,Where is SQLAlchemy's relationship function defined?,,,,,0,b7692c5d098e,,0,b19d845d2bb9
,code_qa,context7,,,,,,,2377.37,,,,,,0,,,,,,,cq042,Where is the Starlette Request class defined?,,,,,0,b7692c5d098e,,0,d6fde15010cf
,code_qa,context7,,,,,,,2468.90,,,,,,0,,,,,,,cq043,Where is aiohttp's web.Application class defined?,,,,,0,b7692c5d098e,,0,c12a4f253667
,code_qa,context7,,,,,,,2365.89,,,,,,0,,,,,,,cq044,Where is torch.optim.Adam defined and what hyperparameters does it accept?,,,,,0,b7692c5d098e,,0,9d3312b9ee11
,code_qa,context7,,,,,,,2685.02,,,,,,0,,,,,,,cq045,Where is pandas.DataFrame.merge defined?,,,,,0,b7692c5d098e,,0,8c5a0b549a4a
,code_qa,context7,,,,,,,2643.15,,,,,,0,,,,,,,cq046,Where is Django's authenticate function called with username and password?,,,,,0,b7692c5d098e,,0,bf09269a165e
,code_qa,context7,,,,,,,2292.86,,,,,,0,,,,,,,cq047,Where is Flask's render_template called with context variables?,,,,,0,b7692c5d098e,,0,23710c1efa87
,code_qa,context7,,,,,,,2803.23,,,,,,0,,,,,,,cq048,Where is session.execute called with a select statement in SQLAlchemy?,,,,,0,b7692c5d098e,,0,748109cfc1bf
,code_qa,context7,,,,,,,1904.49,,,,,,0,,,,,,,cq049,Where is model.fit called in scikit-learn with X_train and y_train?,,,,,0,b7692c5d098e,,0,9302ca07abaa
,code_qa,context7,,,,,,,2216.35,,,,,,0,,,,,,,cq050,Where is torch.save called to persist model state_dict?,,,,,0,b7692c5d098e,,0,a82d662e9621
,code_qa,context7,,,,,,,2579.97,,,,,,0,,,,,,,cq051,Where is pd.concat called with axis=1 to concatenate columns?,,,,,0,b7692c5d098e,,0,b916017a9627
,code_qa,context7,,,,,,,2274.28,,,,,,0,,,,,,,cq052,Where is numpy.einsum called for matrix operations?,,,,,0,b7692c5d098e,,0,0df24d763fba
,code_qa,context7,,,,,,,2619.66,,,,,,0,,,,,,,cq053,Where is requests.post called with json parameter for API calls?,,,,,0,b7692c5d098e,,0,bf1dd9f420e9
,code_qa,context7,,,,,,,2295.26,,,,,,0,,,,,,,cq054,Where is Celery's apply_async called with countdown parameter?,,,,,0,b7692c5d098e,,0,853a54f77381
,code_qa,context7,,,,,,,2237.13,,,,,,0,,,,,,,cq055,Where is httpx.Client.send called with custom transport?,,,,,0,b7692c5d098e,,0,c473340a9009
,code_qa,context7,,,,,,,4062.21,,,,,,0,,,,,,,cq056,Where is LangChain's chain.invoke called with config parameter?,,,,,0,b7692c5d098e,,0,ff3182d303f1
,code_qa,context7,,,,,,,2299.05,,,,,,0,,,,,,,cq057,Where is Django's reverse function called with kwargs?,,,,,0,b7692c5d098e,,0,72780e6690cb
,code_qa,context7,,,,,,,2531.47,,,,,,0,,,,,,,cq058,Where is app.add_middleware called in Starlette-based applications?,,,,,0,b7692c5d098e,,0,1d59e2065f97
,code_qa,context7,,,,,,,2597.75,,,,,,0,,,,,,,cq059,Where is aiohttp's session.get called with ssl=False?,,,,,0,b7692c5d098e,,0,21d403bdd924
,code_qa,context7,,,,,,,2919.58,,,,,,0,,,,,,,cq060,Where is DataFrame.groupby called with as_index=False?,,,,,0,b7692c5d098e,,0,dac032823c83
,code_qa,context7,,,,,,,2461.57,,,,,,0,,,,,,,cq061,Where is torch.nn.CrossEntropyLoss called with label_smoothing?,,,,,0,b7692c5d098e,,0,457d70f17990
,code_qa,context7,,,,,,,2991.71,,,,,,0,,,,,,,cq062,Where is SQLAlchemy's select function called with join for multi-table queries?,,,,,0,b7692c5d098e,,0,9a360fa9c8d2
,code_qa,context7,,,,,,,2881.06,,,,,,0,,,,,,,cq063,How is the embed_dim argument used in torch.nn.MultiheadAttention?,,,,,0,b7692c5d098e,,0,2022f1a99625
,code_qa,context7,,,,,,,2825.77,,,,,,0,,,,,,,cq064,How is the on_delete argument used in Django ForeignKey fields?,,,,,0,b7692c5d098e,,0,b131c1adf79a
,code_qa,context7,,,,,,,2772.41,,,,,,0,,,,,,,cq065,How is the strategy argument used in pandas DataFrame.fillna?,,,,,0,b7692c5d098e,,0,d6a53171059e
,code_qa,context7,,,,,,,2812.43,,,,,,0,,,,,,,cq066,How is the pool_size argument used in SQLAlchemy create_engine?,,,,,0,b7692c5d098e,,0,aebc44d57007
,code_qa,context7,,,,,,,2417.69,,,,,,0,,,,,,,cq067,How is the verify argument used in requests.get for SSL?,,,,,0,b7692c5d098e,,0,4b5b14accf7b
,code_qa,context7,,,,,,,2571.51,,,,,,0,,,,,,,cq068,How is the max_retries argument used in Celery task decorator?,,,,,0,b7692c5d098e,,0,2dde2c443e30
,code_qa,context7,,,,,,,2794.92,,,,,,0,,,,,,,cq069,How is the follow_redirects argument used in httpx requests?,,,,,0,b7692c5d098e,,0,6479ee4693d5
,code_qa,context7,,,,,,,2821.84,,,,,,0,,,,,,,cq070,How is the n_estimators argument used in sklearn RandomForestClassifier?,,,,,0,b7692c5d098e,,0,d9a5fc0ee797
,code_qa,context7,,,,,,,5404.31,,,,,,0,,,,,,,cq071,How is the temperature argument used in LangChain LLM calls?,,,,,0,b7692c5d098e,,0,08ec3f589b59
,code_qa,context7,,,,,,,2812.95,,,,,,0,,,,,,,cq072,How is the lifespan argument used in Starlette Application?,,,,,0,b7692c5d098e,,0,8212c6f4bca8
,code_qa,context7,,,,,,,2573.29,,,,,,0,,,,,,,cq073,How is the trust_env argument used in aiohttp ClientSession?,,,,,0,b7692c5d098e,,0,a7e9d74cd01f
,code_qa,context7,,,,,,,3006.95,,,,,,0,,,,,,,cq074,How is the dtype argument used in numpy zeros and ones?,,,,,0,b7692c5d098e,,0,1967a6d25901
,code_qa,context7,,,,,,,2320.31,,,,,,0,,,,,,,cq075,How is the status_code argument used in FastAPI Response classes?,,,,,0,b7692c5d098e,,0,c8d781d6ca2d
,code_qa,context7,,,,,,,3108.30,,,,,,0,,,,,,,cq076,How is the mode argument used in Pydantic's model_validate?,,,,,0,b7692c5d098e,,0,aec325f6e491
,code_qa,context7,,,,,,,4005.70,,,,,,0,,,,,,,cq077,How is the batch_size argument used in torch.utils.data.DataLoader?,,,,,0,b7692c5d098e,,0,015cd43a2c61
,code_qa,context7,,,,,,,2685.82,,,,,,0,,,,,,,cq078,What is the return type of Django QuerySet.values_list with flat=True?,,,,,0,b7692c5d098e,,0,bddb85ee178c
,code_qa,context7,,,,,,,2157.13,,,,,,0,,,,,,,cq079,What is the return type of Flask's jsonify function?,,,,,0,b7692c5d098e,,0,3940103656e4
,code_qa,context7,,,,,,,2377.48,,,,,,0,,,,,,,cq080,What is the return type of SQLAlchemy Session.execute?,,,,,0,b7692c5d098e,,0,bd2bb36bb618
,code_qa,context7,,,,,,,2706.46,,,,,,0,,,,,,,cq081,What is the return type of requests.Response.json()?,,,,,0,b7692c5d098e,,0,b33d78d8b075
,code_qa,context7,,,,,,,2499.94,,,,,,0,,,,,,,cq082,What is the return type of pandas DataFrame.describe?,,,,,0,b7692c5d098e,,0,2c39b2785f13
,code_qa,context7,,,,,,,2581.85,,,,,,0,,,,,,,cq083,What is the return type of numpy.linalg.svd?,,,,,0,b7692c5d098e,,0,af8e700a9d5f
,code_qa,context7,,,,,,,2292.19,,,,,,0,,,,,,,cq084,What is the return type of torch.nn.Module.parameters()?,,,,,0,b7692c5d098e,,0,4798d690cdeb
,code_qa,context7,,,,,,,2510.07,,,,,,0,,,,,,,cq085,What is the return type of sklearn train_test_split?,,,,,0,b7692c5d098e,,0,db74f40e82c7
,code_qa,context7,,,,,,,2434.66,,,,,,0,,,,,,,cq086,What is the return type of httpx.Response.raise_for_status?,,,,,0,b7692c5d098e,,0,95f98717fa5a
,code_qa,context7,,,,,,,2187.80,,,,,,0,,,,,,,cq087,What is the return type of Celery AsyncResult.get?,,,,,0,b7692c5d098e,,0,3148adf94438
,code_qa,context7,,,,,,,4768.53,,,,,,0,,,,,,,cq088,What is the return type of LangChain's chain.invoke?,,,,,0,b7692c5d098e,,0,f0ede3b25c79
,code_qa,context7,,,,,,,2607.34,,,,,,0,,,,,,,cq089,What classes inherit from Django's View class?,,,,,0,b7692c5d098e,,0,1e11f1fe2cae
,code_qa,context7,,,,,,,2237.50,,,,,,0,,,,,,,cq090,What classes inherit from Flask's MethodView?,,,,,0,b7692c5d098e,,0,30e1bf855188
,code_qa,context7,,,,,,,2941.51,,,,,,0,,,,,,,cq091,What classes inherit from SQLAlchemy's TypeDecorator?,,,,,0,b7692c5d098e,,0,dcd240e4c023
,code_qa,context7,,,,,,,2555.89,,,,,,0,,,,,,,cq092,What classes inherit from torch.nn.Module in the nn package?,,,,,0,b7692c5d098e,,0,4a374bf0d6cd
,code_qa,context7,,,,,,,2158.80,,,,,,0,,,,,,,cq093,What classes inherit from sklearn's TransformerMixin?,,,,,0,b7692c5d098e,,0,00aa3cfe1de1
,code_qa,context7,,,,,,,2582.27,,,,,,0,,,,,,,cq094,What classes inherit from Pydantic BaseModel in the pydantic package itself?,,,,,0,b7692c5d098e,,0,1cf5c923c386
,code_qa,context7,,,,,,,3092.23,,,,,,0,,,,,,,cq095,What classes inherit from Starlette's HTTPEndpoint?,,,,,0,b7692c5d098e,,0,95a7596ad4de
,code_qa,context7,,,,,,,5131.52,,,,,,0,,,,,,,cq096,What classes inherit from aiohttp's AbstractView?,,,,,0,b7692c5d098e,,0,892ab7ba60e0
,code_qa,context7,,,,,,,4215.96,,,,,,0,,,,,,,cq097,What classes inherit from LangChain's BaseRetriever?,,,,,0,b7692c5d098e,,0,8c5d83f59602
,code_qa,context7,,,,,,,2684.85,,,,,,0,,,,,,,cq098,What classes inherit from pandas ExtensionArray?,,,,,0,b7692c5d098e,,0,b0c18c3ed51d
,code_qa,context7,,,,,,,2468.66,,,,,,0,,,,,,,cq099,What classes inherit from Celery's Task base class?,,,,,0,b7692c5d098e,,0,038300474a7a
,code_qa,context7,,,,,,,2520.20,,,,,,0,,,,,,,cq100,Where is Django's path function imported from in URL configurations?,,,,,0,b7692c5d098e,,0,a9b9a15066cd
