benchmark_type,engine,error,error_category,hallucination_rate,latency_ms,num_results,primary_language,primary_repo,query_id,query_text,relevant_tokens_returned,run_id,token_efficiency,total_tokens_returned,trace_id
hallucination,synsc-context,"[{'type': 'invented_method', 'detail': ""Method 'falcon.HTTPStatus' not found in falcon API"", 'call': 'falcon.HTTPStatus', 'context_available': True}, {'type': 'invented_method', 'detail': ""Method 'falcon.HTTPTooManyRequests' not found in falcon API"", 'call': 'falcon.HTTPTooManyRequests', 'context_available': True}, {'type': 'invented_method', 'detail': ""Method 'falcon.HTTPUnauthorized' not found in falcon API"", 'call': 'falcon.HTTPUnauthorized', 'context_available': True}, {'type': 'invented_met",,1.0,0.00,0,,,,"Build a Falcon REST API with middleware, hooks, responders, and ASGI support",0,b29a435e2d3d,,0,5afb42a15673
hallucination,synsc-context,,,0.0,0.00,0,,,,"Implement a TensorFlow 2.x model with tf.data pipeline, custom training, and SavedModel export",0,b29a435e2d3d,,0,e3a80a94d42d
hallucination,synsc-context,"[{'type': 'invented_method', 'detail': ""Method 'create_dask_dataframe' not found in dask API"", 'call': 'create_dask_dataframe', 'context_available': True}, {'type': 'invented_method', 'detail': ""Method 'compute_dask_aggregations' not found in dask API"", 'call': 'compute_dask_aggregations', 'context_available': True}, {'type': 'invented_method', 'detail': ""Method 'filter_and_transform_dask' not found in dask API"", 'call': 'filter_and_transform_dask', 'context_available': True}]",,1.0,0.00,0,,,,"Create a Dask distributed computation with delayed functions, DataFrames, and cluster management",0,b29a435e2d3d,,0,c616d2d3115b
hallucination,synsc-context,,,0.0,0.00,0,,,,"Build a Tortoise ORM application with models, relations, and async query building",0,b29a435e2d3d,,0,620eae878a26
hallucination,synsc-context,,,0.0,0.00,0,,,,"Implement a Peewee ORM application with model definitions, joins, and transaction management",0,b29a435e2d3d,,0,cd94eeeeb532
hallucination,synsc-context,,,0.0,0.00,0,,,,"Set up a requests-based HTTP client with session management, authentication, and streaming",0,b29a435e2d3d,,0,dafbded6eac6
hallucination,synsc-context,"[{'type': 'invented_method', 'detail': ""Method 'create_urllib3_context' not found in urllib3 API"", 'call': 'create_urllib3_context', 'context_available': True}]",,1.0,0.00,0,,,,"Build a urllib3 connection pool with retries, TLS configuration, and proxy support",0,b29a435e2d3d,,0,653f8f186c00
hallucination,synsc-context,,,0.0,0.00,0,,,,"Implement a Gin web server with route groups, middleware, validation, and custom error handling in Go",0,b29a435e2d3d,,0,43eaf675b3de
hallucination,synsc-context,"[{'type': 'invented_method', 'detail': ""Method 'echo.PathParamsBinder' not found in echo API"", 'call': 'echo.PathParamsBinder', 'context_available': True}, {'type': 'invented_method', 'detail': ""Method 'echo.PathParamsBinder' not found in echo API"", 'call': 'echo.PathParamsBinder', 'context_available': True}, {'type': 'invented_method', 'detail': ""Method 'echo.PathParamsBinder' not found in echo API"", 'call': 'echo.PathParamsBinder', 'context_available': True}]",,1.0,0.00,0,,,,"Build an Echo web application with middleware, request binding, and response rendering in Go",0,b29a435e2d3d,,0,0801a99d3888
hallucination,synsc-context,,,0.0,0.00,0,,,,"Implement a GORM database layer with models, associations, hooks, and scoped queries in Go",0,b29a435e2d3d,,0,87b849bba530
hallucination,synsc-context,,,0.0,0.00,0,,,,"Build an Actix-web server with extractors, middleware, state management, and error handling in Rust",0,b29a435e2d3d,,0,0d60f7c94487
hallucination,synsc-context,,,0.0,0.00,0,,,,"Implement a Tokio async runtime with channels, select, timers, and spawned tasks in Rust",0,b29a435e2d3d,,0,6670b638937e
hallucination,synsc-context,"[{'type': 'invented_method', 'detail': ""Method 'run_rust_serde_example' not found in serde API"", 'call': 'run_rust_serde_example', 'context_available': True}, {'type': 'invented_method', 'detail': ""Method 'serde' not found in serde API"", 'call': 'serde', 'context_available': True}, {'type': 'invented_method', 'detail': ""Method 'serde' not found in serde API"", 'call': 'serde', 'context_available': True}, {'type': 'invented_method', 'detail': ""Method 'serde' not found in serde API"", 'call': 'serde",,1.0,0.00,0,,,,"Build a Serde serialization layer with custom derive, field attributes, and format support in Rust",0,b29a435e2d3d,,0,1db3e3a5bed7
hallucination,synsc-context,,,0.0,0.00,0,,,,"Implement a Django REST Framework API with serializers, viewsets, permissions, and pagination",0,b29a435e2d3d,,0,e647eed6586b
hallucination,synsc-context,,,0.0,0.00,0,,,,"Create a Dramatiq task queue with actors, middleware, results backend, and rate limiting",0,b29a435e2d3d,,0,61a54bb5257d
hallucination,synsc-context,"[{'type': 'invented_method', 'detail': ""Method 'RQ' not found in rq API"", 'call': 'RQ', 'context_available': True}]",,1.0,0.00,0,,,,"Build an RQ (Redis Queue) worker setup with job scheduling, failure handling, and monitoring",0,b29a435e2d3d,,0,520d2d1d0f91
hallucination,synsc-context,,,0.0,0.00,0,,,,"Set up a Django 5 model layer with custom managers, querysets, signals, and migration operations",0,b29a435e2d3d,,0,b3a3109c2953
hallucination,synsc-context,"[{'type': 'wrong_parameter', 'detail': ""Parameter 'early_stopping_method' not valid for AgentExecutor()"", 'call': 'AgentExecutor', 'parameter': 'early_stopping_method', 'context_available': True}]",,1.0,0.00,0,,,,"Build a multi-step LangChain agent with tool calling, memory, and structured output",0,b29a435e2d3d,,0,e3de503c29b1
hallucination,synsc-context,,,0.0,0.00,0,,,,"Create a FastAPI application with OAuth2 authentication, dependency injection, and background tasks",0,b29a435e2d3d,,0,66b4ab8a70d3
hallucination,synsc-context,,,0.0,0.00,0,,,,Implement a complex Pydantic v2 settings management with environment variable parsing and nested configs,0,b29a435e2d3d,,0,e6c5591e610f
hallucination,synsc-context,,,0.0,0.00,0,,,,"Build a PyTorch Lightning training module with callbacks, logging, and distributed training",0,b29a435e2d3d,,0,7949cd7eff39
hallucination,synsc-context,,,0.0,0.00,0,,,,"Build a Next.js API route handler with middleware, streaming responses, and server actions",0,b29a435e2d3d,,0,b473ad1dd41a
hallucination,synsc-context,,,0.0,0.00,0,,,,"Create a comprehensive test suite with pytest including fixtures, parametrize, mocking, and async tests",0,b29a435e2d3d,,0,8ae50833b53b
hallucination,synsc-context,"[{'type': 'invented_method', 'detail': ""Method 'generate_mypy_config' not found in mypy API"", 'call': 'generate_mypy_config', 'context_available': True}, {'type': 'invented_method', 'detail': ""Method 'generate_pyproject_toml_mypy_section' not found in mypy API"", 'call': 'generate_pyproject_toml_mypy_section', 'context_available': True}, {'type': 'invented_method', 'detail': ""Method 'generate_pydantic_mypy_plugin_config' not found in mypy API"", 'call': 'generate_pydantic_mypy_plugin_config', 'con",,1.0,0.00,0,,,,"Set up a comprehensive mypy type checking configuration with plugins, overrides, and strict mode",0,b29a435e2d3d,,0,f7e2e2838832
hallucination,synsc-context,,,0.0,0.00,0,,,,"Build a SQLAlchemy 2.0 model with hybrid properties, custom types, and event listeners",0,b29a435e2d3d,,0,e86bb94e8781
hallucination,synsc-context,,,0.0,0.00,0,,,,"Implement a complete Docker Compose setup with multi-stage builds, health checks, and network configuration",0,b29a435e2d3d,,0,b477a9b1065d
hallucination,synsc-context,,,0.0,0.00,0,,,,"Create a Kubernetes deployment manifest with rolling updates, resource limits, probes, and autoscaling",0,b29a435e2d3d,,0,b83e36871c99
hallucination,synsc-context,"[{'type': 'invented_method', 'detail': ""Method 'generate_webpack_config' not found in webpack API"", 'call': 'generate_webpack_config', 'context_available': True}]",,1.0,0.00,0,,,,"Build a Webpack 5 configuration with code splitting, module federation, and asset optimization",0,b29a435e2d3d,,0,fafe98a8de73
hallucination,synsc-context,,,0.0,0.00,0,,,,"Create a Matplotlib visualization with subplots, custom styling, annotations, and interactive features",0,b29a435e2d3d,,0,3364d76d3bb2
hallucination,synsc-context,"[{'type': 'wrong_parameter', 'detail': ""Parameter 'vertical_spacing' not valid for make_subplots()"", 'call': 'make_subplots', 'parameter': 'vertical_spacing', 'context_available': True}, {'type': 'wrong_parameter', 'detail': ""Parameter 'horizontal_spacing' not valid for make_subplots()"", 'call': 'make_subplots', 'parameter': 'horizontal_spacing', 'context_available': True}]",,1.0,0.00,0,,,,"Build a Plotly interactive dashboard with subplots, animations, and custom themes",0,b29a435e2d3d,,0,df8f3a3ee9bc
hallucination,synsc-context,,,0.0,0.00,0,,,,"Create a Seaborn statistical visualization with faceted plots, regression, and custom palettes",0,b29a435e2d3d,,0,2ebc8b451a8c
hallucination,synsc-context,,,0.0,0.00,0,,,,Implement a Celery beat scheduler with timezone-aware periodic tasks and dynamic scheduling,0,b29a435e2d3d,,0,7e64f2550a9d
hallucination,synsc-context,,,0.0,0.00,0,,,,"Build a comprehensive Alembic migration setup with auto-generation, batch operations, and data migrations",0,b29a435e2d3d,,0,b046e0c085dc
hallucination,synsc-context,,,0.0,0.00,0,,,,"Implement a Marshmallow schema with nested objects, custom fields, and two-way serialization",0,b29a435e2d3d,,0,128b71d6375d
hallucination,synsc-context,,,0.0,0.00,0,,,,"Create a comprehensive AWS Boto3 setup for S3 operations with presigned URLs, multipart upload, and lifecycle rules",0,b29a435e2d3d,,0,d63e6e0d672d
hallucination,synsc-context,,,0.0,0.00,0,,,,"Implement Google Cloud Firestore operations with transactions, batch writes, and real-time listeners",0,b29a435e2d3d,,0,2142dff6df28
hallucination,synsc-context,"[{'type': 'invented_method', 'detail': ""Method 'Celery' not found in celery API"", 'call': 'Celery', 'context_available': True}]",,1.0,0.00,0,,,,"Build a Celery task with custom serializers, priority queues, and canvas workflows",0,b29a435e2d3d,,0,cf55f1a3fd05
hallucination,synsc-context,,,0.0,0.00,0,,,,"Create an OpenAI API integration with chat completions, function calling, streaming, and embeddings",0,b29a435e2d3d,,0,3b1c0338f647
hallucination,synsc-context,"[{'type': 'invented_method', 'detail': ""Method 'ChatAnthropic' not found in anthropic API"", 'call': 'ChatAnthropic', 'context_available': True}]",,1.0,0.00,0,,,,"Build a Anthropic Claude integration with streaming, tool use, and multi-turn conversations",0,b29a435e2d3d,,0,e465948af129
hallucination,synsc-context,"[{'type': 'invented_method', 'detail': ""Method '_get_supabase_url' not found in supabase API"", 'call': '_get_supabase_url', 'context_available': True}, {'type': 'invented_method', 'detail': ""Method '_get_supabase_service_key' not found in supabase API"", 'call': '_get_supabase_service_key', 'context_available': True}, {'type': 'invented_method', 'detail': ""Method '_get_supabase_publishable_key' not found in supabase API"", 'call': '_get_supabase_publishable_key', 'context_available': True}, {'type",,1.0,0.00,0,,,,"Implement a Supabase backend with auth, real-time subscriptions, storage, and edge functions",0,b29a435e2d3d,,0,32bf9114ddf1
hallucination,synsc-context,"[{'type': 'invented_method', 'detail': ""Method 'generate_github_actions_workflow' not found in github-actions API"", 'call': 'generate_github_actions_workflow', 'context_available': True}, {'type': 'invented_method', 'detail': ""Method 'generate_github_actions_workflow' not found in github-actions API"", 'call': 'generate_github_actions_workflow', 'context_available': True}]",,1.0,0.00,0,,,,"Build a comprehensive GitHub Actions workflow with matrix strategy, caching, artifacts, and reusable workflows",0,b29a435e2d3d,,0,88664f1de5f5
hallucination,synsc-context,"[{'type': 'invented_method', 'detail': ""Method 'create_terraform_infrastructure' not found in terraform API"", 'call': 'create_terraform_infrastructure', 'context_available': True}]",,1.0,0.00,0,,,,"Create a Terraform infrastructure configuration with modules, state management, and provider configuration",0,b29a435e2d3d,,0,e66b82835d61
hallucination,synsc-context,,,0.0,0.00,0,,,,"Implement a Svelte 5 component with runes, snippets, and fine-grained reactivity",0,b29a435e2d3d,,0,bedf55f829db
hallucination,synsc-context,,,0.0,0.00,0,,,,"Build a Vue 3 application with Composition API, Pinia store, and Vue Router 4",0,b29a435e2d3d,,0,947047b81d4a
hallucination,synsc-context,"[{'type': 'invented_method', 'detail': ""Method 'generate_angular17_app' not found in angular API"", 'call': 'generate_angular17_app', 'context_available': True}]",,1.0,0.00,0,,,,"Create an Angular 17 application with signals, standalone components, and new control flow",0,b29a435e2d3d,,0,2f25fdefc531
hallucination,synsc-context,,,0.0,0.00,0,,,,"Build a GraphQL API with Strawberry framework including subscriptions, dataloaders, and authentication",0,b29a435e2d3d,,0,11f27160bab7
hallucination,synsc-context,,,0.0,0.00,0,,,,"Create a comprehensive Pillow image processing pipeline with filters, compositing, and format conversion",0,b29a435e2d3d,,0,b198471e084d
hallucination,synsc-context,,,0.0,0.00,0,,,,Implement a comprehensive Arrow/Parquet data pipeline with PyArrow for columnar data processing,0,b29a435e2d3d,,0,56763b2fc603
hallucination,synsc-context,,,0.0,0.00,0,,,,"Build a comprehensive cryptography setup with Fernet encryption, RSA key pairs, and certificate generation",0,b29a435e2d3d,,0,dc576a225e6c
hallucination,synsc-context,,,0.0,0.00,0,,,,"Create an Elasticsearch query with aggregations, highlighting, and suggesters using elasticsearch-py",0,b29a435e2d3d,,0,8a4a9fa7c898
hallucination,synsc-context,,,0.0,0.00,0,,,,"Implement a comprehensive GraphQL server with Ariadne including schema-first design, subscriptions, and uploads",0,b29a435e2d3d,,0,a927717b4195
hallucination,synsc-context,"[{'type': 'invented_method', 'detail': ""Method 'context_to_airflow_vars' not found in airflow API"", 'call': 'context_to_airflow_vars', 'context_available': True}, {'type': 'invented_method', 'detail': ""Method 'context_to_airflow_vars' not found in airflow API"", 'call': 'context_to_airflow_vars', 'context_available': True}, {'type': 'invented_method', 'detail': ""Method 'context_to_airflow_vars' not found in airflow API"", 'call': 'context_to_airflow_vars', 'context_available': True}, {'type': 'inv",,1.0,0.00,0,,,,"Build a comprehensive Airflow DAG with task dependencies, sensors, hooks, and dynamic task mapping",0,b29a435e2d3d,,0,efde1dcf178d
hallucination,synsc-context,"[{'type': 'wrong_parameter', 'detail': ""Parameter 'cache_policy' not valid for task()"", 'call': 'task', 'parameter': 'cache_policy', 'context_available': True}, {'type': 'wrong_parameter', 'detail': ""Parameter 'hours' not valid for task()"", 'call': 'task', 'parameter': 'hours', 'context_available': True}, {'type': 'wrong_parameter', 'detail': ""Parameter 'cache_policy' not valid for task()"", 'call': 'task', 'parameter': 'cache_policy', 'context_available': True}, {'type': 'wrong_parameter', 'deta",,1.0,0.00,0,,,,"Create a comprehensive Prefect 2 flow with tasks, retries, caching, and deployment configuration",0,b29a435e2d3d,,0,2b52c85da34a
hallucination,synsc-context,"[{'type': 'invented_method', 'detail': ""Method 'grpc.unary_unary_rpc_method_handler' not found in grpc API"", 'call': 'grpc.unary_unary_rpc_method_handler', 'context_available': True}]",,1.0,0.00,0,,,,"Implement a comprehensive gRPC service with protobuf, streaming, interceptors, and health checks in Python",0,b29a435e2d3d,,0,87e690fa281a
hallucination,synsc-context,,,0.0,0.00,0,,,,"Build a FastAPI WebSocket server with connection management, broadcasting, and heartbeat",0,b29a435e2d3d,,0,e386a8dd46af
hallucination,synsc-context,"[{'type': 'wrong_parameter', 'detail': ""Parameter 'default_factory' not valid for Field()"", 'call': 'Field', 'parameter': 'default_factory', 'context_available': True}, {'type': 'wrong_parameter', 'detail': ""Parameter 'default_factory' not valid for Field()"", 'call': 'Field', 'parameter': 'default_factory', 'context_available': True}, {'type': 'wrong_parameter', 'detail': ""Parameter 'default_factory' not valid for Field()"", 'call': 'Field', 'parameter': 'default_factory', 'context_available': Tr",,1.0,0.00,0,,,,"Create a SQLModel application with models, relationships, and async database operations",0,b29a435e2d3d,,0,471a2d9d1f7b
hallucination,synsc-context,"[{'type': 'invented_method', 'detail': ""Method 'tauri.conf.json' not found in tauri API"", 'call': 'tauri.conf.json', 'context_available': True}]",,1.0,0.00,0,,,,"Build a Tauri desktop application with commands, state management, and event system using Rust backend",0,b29a435e2d3d,,0,05165bbd2670
hallucination,synsc-context,,,0.0,0.00,0,,,,"Implement a comprehensive Pytest-BDD test suite with scenarios, step definitions, and fixtures",0,b29a435e2d3d,,0,a6e6111060c2
hallucination,synsc-context,,,0.0,0.00,0,,,,"Create a Pydantic AI agent with tool definitions, structured output, and retry handling",0,b29a435e2d3d,,0,f2556587809e
hallucination,synsc-context,"[{'type': 'invented_method', 'detail': ""Method 'RegexPipelineError' not found in re API"", 'call': 'RegexPipelineError', 'context_available': True}, {'type': 'invented_method', 'detail': ""Method 'register' not found in re API"", 'call': 'register', 'context_available': True}, {'type': 'invented_method', 'detail': ""Method 'RegexPipelineError' not found in re API"", 'call': 'RegexPipelineError', 'context_available': True}, {'type': 'invented_method', 'detail': ""Method 'RegexPipelineError' not found i",,1.0,0.00,0,,,,"Build a comprehensive Regex pattern matching pipeline with named groups, lookahead, and Unicode support",0,b29a435e2d3d,,0,7bafdb28cb00
hallucination,synsc-context,"[{'type': 'wrong_parameter', 'detail': ""Parameter 'ge' not valid for Field()"", 'call': 'Field', 'parameter': 'ge', 'context_available': True}, {'type': 'wrong_parameter', 'detail': ""Parameter 'le' not valid for Field()"", 'call': 'Field', 'parameter': 'le', 'context_available': True}]",,1.0,0.00,0,,,,"Create a Pydantic dataclass with field aliases, discriminated unions, and custom JSON encoders",0,b29a435e2d3d,,0,96eff2312bcc
hallucination,synsc-context,,,0.0,0.00,0,,,,Implement a complete HTMX-powered Django application with server-sent events and WebSocket fallback,0,b29a435e2d3d,,0,974b9c4350ae
hallucination,synsc-context,,,0.0,0.00,0,,,,"Build a Neon serverless Postgres application with connection pooling, branching, and edge functions",0,b29a435e2d3d,,0,bfd281f1ae58
hallucination,synsc-context,"[{'type': 'invented_method', 'detail': ""Method 'TRPCErrorCode' not found in trpc API"", 'call': 'TRPCErrorCode', 'context_available': True}]",,1.0,0.00,0,,,,"Create a comprehensive tRPC API with routers, middleware, subscriptions, and React integration",0,b29a435e2d3d,,0,85ff7fdfe70d
