benchmark_type,engine,error,error_category,hallucination_rate,latency_ms,num_results,primary_language,primary_repo,query_id,query_text,relevant_tokens_returned,run_id,token_efficiency,total_tokens_returned,trace_id
hallucination,nia,,,0.0,0.00,0,,,,"Build a comprehensive Airflow DAG with task dependencies, sensors, hooks, and dynamic task mapping",0,e71e05d58497,,0,d2f04a73b360
hallucination,nia,"[{'type': 'wrong_parameter', 'detail': ""Parameter 'hours' not valid for task()"", 'call': 'task', 'parameter': 'hours', 'context_available': True}, {'type': 'wrong_parameter', 'detail': ""Parameter 'minutes' not valid for task()"", 'call': 'task', 'parameter': 'minutes', 'context_available': True}]",,1.0,0.00,0,,,,"Create a comprehensive Prefect 2 flow with tasks, retries, caching, and deployment configuration",0,e71e05d58497,,0,a0398a534cdc
hallucination,nia,"[{'type': 'invented_method', 'detail': ""Method 'GRPCError' not found in grpc API"", 'call': 'GRPCError', 'context_available': True}, {'type': 'invented_method', 'detail': ""Method 'grpc.unary_unary_rpc_method_handler' not found in grpc API"", 'call': 'grpc.unary_unary_rpc_method_handler', 'context_available': True}, {'type': 'invented_method', 'detail': ""Method 'grpc.unary_stream_rpc_method_handler' not found in grpc API"", 'call': 'grpc.unary_stream_rpc_method_handler', 'context_available': True}, ",,1.0,0.00,0,,,,"Implement a comprehensive gRPC service with protobuf, streaming, interceptors, and health checks in Python",0,e71e05d58497,,0,27c80757ab15
hallucination,nia,,,0.0,0.00,0,,,,"Build a FastAPI WebSocket server with connection management, broadcasting, and heartbeat",0,e71e05d58497,,0,0c958f6f8ac7
hallucination,nia,,,0.0,0.00,0,,,,"Create a SQLModel application with models, relationships, and async database operations",0,e71e05d58497,,0,e5b08774f339
hallucination,nia,"[{'type': 'invented_method', 'detail': ""Method 'create_tauri_app' not found in tauri API"", 'call': 'create_tauri_app', 'context_available': True}]",,1.0,0.00,0,,,,"Build a Tauri desktop application with commands, state management, and event system using Rust backend",0,e71e05d58497,,0,a8995837458f
hallucination,nia,"[{'type': 'invented_method', 'detail': ""Method 'pytest.fixture' not found in pytest-bdd API"", 'call': 'pytest.fixture', 'context_available': True}, {'type': 'wrong_parameter', 'detail': ""Parameter 'target_fixture' not valid for when()"", 'call': 'when', 'parameter': 'target_fixture', 'context_available': True}]",,1.0,0.00,0,,,,"Implement a comprehensive Pytest-BDD test suite with scenarios, step definitions, and fixtures",0,e71e05d58497,,0,ed128e7b47c1
hallucination,nia,"[{'type': 'wrong_parameter', 'detail': ""Parameter 'output_type' not valid for Agent()"", 'call': 'Agent', 'parameter': 'output_type', 'context_available': True}, {'type': 'wrong_parameter', 'detail': ""Parameter 'instructions' not valid for Agent()"", 'call': 'Agent', 'parameter': 'instructions', 'context_available': True}, {'type': 'invented_method', 'detail': ""Method 'response.raise_for_status' not found in pydantic-ai API"", 'call': 'response.raise_for_status', 'context_available': True}]",,1.0,0.00,0,,,,"Create a Pydantic AI agent with tool definitions, structured output, and retry handling",0,e71e05d58497,,0,0acf7c071600
hallucination,nia,"[{'type': 'invented_method', 'detail': ""Method 'results.append' not found in re API"", 'call': 'results.append', 'context_available': True}, {'type': 'invented_method', 'detail': ""Method 'extract_currencies' not found in re API"", 'call': 'extract_currencies', 'context_available': True}]",,1.0,0.00,0,,,,"Build a comprehensive Regex pattern matching pipeline with named groups, lookahead, and Unicode support",0,e71e05d58497,,0,3a1e38759d0c
hallucination,nia,"[{'type': 'wrong_parameter', 'detail': ""Parameter 'gt' not valid for Field()"", 'call': 'Field', 'parameter': 'gt', 'context_available': True}]",,1.0,0.00,0,,,,"Create a Pydantic dataclass with field aliases, discriminated unions, and custom JSON encoders",0,e71e05d58497,,0,b59c4fea6ce9
hallucination,nia,"[{'type': 'invented_method', 'detail': ""Method 'django.setup' not found in django-htmx API"", 'call': 'django.setup', 'context_available': True}]",,1.0,0.00,0,,,,Implement a complete HTMX-powered Django application with server-sent events and WebSocket fallback,0,e71e05d58497,,0,a3918a115b6d
hallucination,nia,"[{'type': 'invented_method', 'detail': ""Method 'NeonConnectionPool' not found in neon API"", 'call': 'NeonConnectionPool', 'context_available': True}]",,1.0,0.00,0,,,,"Build a Neon serverless Postgres application with connection pooling, branching, and edge functions",0,e71e05d58497,,0,bc94fd3abdb4
hallucination,nia,"[{'type': 'invented_method', 'detail': ""Method 'generate_trpc_setup' not found in trpc API"", 'call': 'generate_trpc_setup', 'context_available': True}]",,1.0,0.00,0,,,,"Create a comprehensive tRPC API with routers, middleware, subscriptions, and React integration",0,e71e05d58497,,0,1c93088e997b
hallucination,context7,,,0.0,0.00,0,,,,Create a FastAPI endpoint that accepts a JSON body with nested Pydantic models and returns a validated response,0,e71e05d58497,,0,064c23df4eb3
hallucination,context7,,,0.0,0.00,0,,,,"Set up an async HTTPX client with custom timeout, retry logic, and connection pooling",0,e71e05d58497,,0,274be3b24c39
hallucination,context7,"[{'type': 'outdated_api', 'detail': ""'field_validator' uses deprecated API 'validator'"", 'call': 'field_validator', 'context_available': True}, {'type': 'outdated_api', 'detail': ""'field_validator' uses deprecated API 'validator'"", 'call': 'field_validator', 'context_available': True}, {'type': 'outdated_api', 'detail': ""'field_validator' uses deprecated API 'validator'"", 'call': 'field_validator', 'context_available': True}, {'type': 'outdated_api', 'detail': ""'field_validator' uses deprecated ",,1.0,0.00,0,,,,"Define a Pydantic v2 model with custom validators, computed fields, and JSON schema customization",0,e71e05d58497,,0,b14b29f9664b
hallucination,context7,,,0.0,0.00,0,,,,Implement SQLAlchemy 2.0 async session with select statements and relationship loading,0,e71e05d58497,,0,ad0c1c06b6b1
hallucination,context7,"[{'type': 'invented_method', 'detail': ""Method 'click.BadParameter' not found in click API"", 'call': 'click.BadParameter', 'context_available': True}, {'type': 'invented_method', 'detail': ""Method 'click.BadParameter' not found in click API"", 'call': 'click.BadParameter', 'context_available': True}, {'type': 'invented_method', 'detail': ""Method 'click.version_option' not found in click API"", 'call': 'click.version_option', 'context_available': True}]",,1.0,0.00,0,,,,"Create a Click CLI application with nested command groups, options with validation, and rich help text",0,e71e05d58497,,0,bda91a026857
hallucination,context7,"[{'type': 'wrong_parameter', 'detail': ""Parameter 'openai_api_key' not valid for ChatOpenAI()"", 'call': 'ChatOpenAI', 'parameter': 'openai_api_key', 'context_available': True}]",,1.0,0.00,0,,,,"Build a LangChain RAG pipeline with document loading, text splitting, vector store, and retrieval chain",0,e71e05d58497,,0,ad42b6519c96
hallucination,context7,,,0.0,0.00,0,,,,"Implement a PyTorch training loop with mixed precision, gradient accumulation, and learning rate scheduling",0,e71e05d58497,,0,b0d0cd53363a
hallucination,context7,"[{'type': 'invented_method', 'detail': ""Method 'stripe.StripeClient' not found in stripe API"", 'call': 'stripe.StripeClient', 'context_available': True}, {'type': 'invented_method', 'detail': ""Method 'stripe.checkout.Session.create' not found in stripe API"", 'call': 'stripe.checkout.Session.create', 'context_available': True}, {'type': 'invented_method', 'detail': ""Method 'stripe.Webhook.construct_event' not found in stripe API"", 'call': 'stripe.Webhook.construct_event', 'context_available': Tru",,1.0,0.00,0,,,,"Create a Stripe payment integration with checkout sessions, webhooks, and subscription management",0,e71e05d58497,,0,63797231f5c4
hallucination,context7,"[{'type': 'invented_method', 'detail': ""Method 'create_nextjs_app_router_files' not found in next API"", 'call': 'create_nextjs_app_router_files', 'context_available': True}, {'type': 'invented_method', 'detail': ""Method 'create_nextjs_app_router_files' not found in next API"", 'call': 'create_nextjs_app_router_files', 'context_available': True}]",,1.0,0.00,0,,,,"Build a Next.js App Router page with server components, data fetching, and loading states",0,e71e05d58497,,0,62fc52fdaf98
hallucination,context7,,,0.0,0.00,0,,,,"Set up a Tailwind CSS v4 configuration with custom theme, plugins, and dark mode",0,e71e05d58497,,0,eefee341d394
hallucination,context7,"[{'type': 'wrong_parameter', 'detail': ""Parameter 'author' not valid for Q()"", 'call': 'Q', 'parameter': 'author', 'context_available': True}, {'type': 'wrong_parameter', 'detail': ""Parameter 'content__icontains' not valid for Q()"", 'call': 'Q', 'parameter': 'content__icontains', 'context_available': True}]",,1.0,0.00,0,,,,"Build a Django 5 REST API with class-based views, custom permissions, and queryset filtering",0,e71e05d58497,,0,55638aba5571
hallucination,context7,,,0.0,0.00,0,,,,"Create a Flask application with Blueprints, custom error handlers, and SQLAlchemy integration",0,e71e05d58497,,0,3e0959fc4c64
hallucination,context7,,,0.0,0.00,0,,,,"Implement a pandas DataFrame pipeline with method chaining, window functions, and categorical data handling",0,e71e05d58497,,0,ced0f69dbc1d
hallucination,context7,,,0.0,0.00,0,,,,"Build a NumPy computation pipeline with broadcasting, structured arrays, and random number generation",0,e71e05d58497,,0,cd72f22dd2c7
hallucination,context7,,,0.0,0.00,0,,,,"Perform SciPy optimization with constraints, curve fitting, and sparse matrix operations",0,e71e05d58497,,0,8ff99c129b71
hallucination,context7,,,0.0,0.00,0,,,,"Build a Polars data pipeline with lazy frames, window functions, and expression API",0,e71e05d58497,,0,af8c292968bd
hallucination,context7,"[{'type': 'wrong_parameter', 'detail': ""Parameter 'n_std' not valid for Pipeline()"", 'call': 'Pipeline', 'parameter': 'n_std', 'context_available': True}]",,1.0,0.00,0,,,,"Train a scikit-learn pipeline with custom transformers, cross-validation, and hyperparameter search",0,e71e05d58497,,0,d0b2639342fb
hallucination,context7,"[{'type': 'wrong_parameter', 'detail': ""Parameter 'warmup_steps' not valid for TrainingArguments()"", 'call': 'TrainingArguments', 'parameter': 'warmup_steps', 'context_available': True}, {'type': 'wrong_parameter', 'detail': ""Parameter 'logging_dir' not valid for TrainingArguments()"", 'call': 'TrainingArguments', 'parameter': 'logging_dir', 'context_available': True}, {'type': 'wrong_parameter', 'detail': ""Parameter 'eval_steps' not valid for TrainingArguments()"", 'call': 'TrainingArguments', 'p",,1.0,0.00,0,,,,"Fine-tune a HuggingFace Transformers model with the Trainer API, custom data collator, and evaluation metrics",0,e71e05d58497,,0,3b338ae667eb
hallucination,context7,"[{'type': 'invented_method', 'detail': ""Method 'keras' not found in keras API"", 'call': 'keras', 'context_available': True}, {'type': 'invented_method', 'detail': ""Method 'keras.metrics.Mean' not found in keras API"", 'call': 'keras.metrics.Mean', 'context_available': True}, {'type': 'invented_method', 'detail': ""Method 'keras.metrics.CategoricalAccuracy' not found in keras API"", 'call': 'keras.metrics.CategoricalAccuracy', 'context_available': True}, {'type': 'invented_method', 'detail': ""Method",,1.0,0.00,0,,,,"Create a Keras 3 model with functional API, custom training step, and multi-backend support",0,e71e05d58497,,0,d71c4cb13a6c
hallucination,context7,"[{'type': 'invented_method', 'detail': ""Method 'asyncio.as_completed' not found in asyncio API"", 'call': 'asyncio.as_completed', 'context_available': True}]",,1.0,0.00,0,,,,"Implement asyncio concurrent tasks with structured concurrency, timeout handling, and cancellation",0,e71e05d58497,,0,e9ad4eea9043
hallucination,context7,,,0.0,0.00,0,,,,"Set up a Celery task queue with periodic tasks, result backends, retry policies, and task chaining",0,e71e05d58497,,0,f2e8b2608791
hallucination,context7,"[{'type': 'invented_method', 'detail': ""Method 'redis.call' not found in redis-py API"", 'call': 'redis.call', 'context_available': True}, {'type': 'invented_method', 'detail': ""Method 'redis.call' not found in redis-py API"", 'call': 'redis.call', 'context_available': True}, {'type': 'invented_method', 'detail': ""Method 'redis.call' not found in redis-py API"", 'call': 'redis.call', 'context_available': True}, {'type': 'invented_method', 'detail': ""Method 'redis.call' not found in redis-py API"", '",,1.0,0.00,0,,,,"Build a Redis cache layer with pipelining, pub/sub messaging, and Lua scripting using redis-py",0,e71e05d58497,,0,f512b5f1a87c
hallucination,context7,,,0.0,0.00,0,,,,"Implement a PyMongo aggregation pipeline with lookup, group, faceted search, and change streams",0,e71e05d58497,,0,d052a372c034
hallucination,context7,"[{'type': 'invented_method', 'detail': ""Method 'app.add_typer' not found in typer API"", 'call': 'app.add_typer', 'context_available': True}, {'type': 'invented_method', 'detail': ""Method 'app.add_typer' not found in typer API"", 'call': 'app.add_typer', 'context_available': True}, {'type': 'invented_method', 'detail': ""Method 'app.add_typer' not found in typer API"", 'call': 'app.add_typer', 'context_available': True}]",,1.0,0.00,0,,,,"Create a Typer CLI application with subcommands, rich help panels, and automatic shell completion",0,e71e05d58497,,0,4e0f9acaac21
hallucination,context7,"[{'type': 'wrong_parameter', 'detail': ""Parameter 'highlight' not valid for Table()"", 'call': 'Table', 'parameter': 'highlight', 'context_available': True}, {'type': 'wrong_parameter', 'detail': ""Parameter 'header_style' not valid for Table()"", 'call': 'Table', 'parameter': 'header_style', 'context_available': True}, {'type': 'wrong_parameter', 'detail': ""Parameter 'header_style' not valid for Table()"", 'call': 'Table', 'parameter': 'header_style', 'context_available': True}]",,1.0,0.00,0,,,,"Build a Rich terminal UI with live display, tables, progress bars, and tree views",0,e71e05d58497,,0,efb698ef0c8b
hallucination,context7,"[{'type': 'invented_method', 'detail': ""Method 'structlog.stdlib.PositionalArgumentsFormatter' not found in structlog API"", 'call': 'structlog.stdlib.PositionalArgumentsFormatter', 'context_available': True}, {'type': 'invented_method', 'detail': ""Method 'structlog.processors.TimeStamper' not found in structlog API"", 'call': 'structlog.processors.TimeStamper', 'context_available': True}, {'type': 'invented_method', 'detail': ""Method 'structlog.processors.StackInfoRenderer' not found in structlog",,1.0,0.00,0,,,,"Set up structured logging with structlog including processors, formatters, and context binding",0,e71e05d58497,,0,afa80ae90f52
hallucination,context7,,,0.0,0.00,0,,,,"Create a Loguru logging setup with rotation, serialization, custom sinks, and structured output",0,e71e05d58497,,0,c6d1bb4b8907
hallucination,context7,"[{'type': 'invented_method', 'detail': ""Method 'ReactDOMClient.createRoot' not found in react API"", 'call': 'ReactDOMClient.createRoot', 'context_available': True}, {'type': 'invented_method', 'detail': ""Method 'ReactDOMClient.createRoot' not found in react API"", 'call': 'ReactDOMClient.createRoot', 'context_available': True}]",,1.0,0.00,0,,,,"Build a React 19 application with server components, use hook, and concurrent features",0,e71e05d58497,,0,13ce9089309c
hallucination,context7,"[{'type': 'invented_method', 'detail': ""Method 'Express.js' not found in express API"", 'call': 'Express.js', 'context_available': True}]",,1.0,0.00,0,,,,"Implement an Express.js REST API with middleware chain, error handling, and route organization",0,e71e05d58497,,0,712476a4e50c
hallucination,context7,"[{'type': 'invented_method', 'detail': ""Method 'Prisma' not found in prisma API"", 'call': 'Prisma', 'context_available': True}]",,1.0,0.00,0,,,,"Create a Prisma schema with relations, middleware, and complex queries using the client",0,e71e05d58497,,0,7b27aefcb85b
hallucination,context7,,,0.0,0.00,0,,,,"Build a Zod schema with complex validation, transforms, and type inference for a TypeScript API",0,e71e05d58497,,0,20cacaae637a
hallucination,context7,"[{'type': 'invented_method', 'detail': ""Method 'set_query_data' not found in tanstack-query API"", 'call': 'set_query_data', 'context_available': True}, {'type': 'invented_method', 'detail': ""Method 'self._query_cache.get' not found in tanstack-query API"", 'call': 'self._query_cache.get', 'context_available': True}, {'type': 'invented_method', 'detail': ""Method 'get_query_data' not found in tanstack-query API"", 'call': 'get_query_data', 'context_available': True}, {'type': 'invented_method', 'det",,1.0,0.00,0,,,,"Implement TanStack Query v5 with mutations, optimistic updates, and infinite scroll pagination",0,e71e05d58497,,0,eb8383564452
hallucination,context7,,,0.0,0.00,0,,,,"Build a Starlette ASGI application with WebSocket support, middleware, and background tasks",0,e71e05d58497,,0,3c3d12caef17
hallucination,context7,,,0.0,0.00,0,,,,"Create an aiohttp web server with WebSocket support, sessions, and middleware",0,e71e05d58497,,0,764bc38c8c91
hallucination,context7,,,0.0,0.00,0,,,,"Build a Tornado web application with async request handlers, WebSockets, and coroutine patterns",0,e71e05d58497,,0,1224b0ab3008
hallucination,context7,"[{'type': 'invented_method', 'detail': ""Method 'sanic_json' not found in sanic API"", 'call': 'sanic_json', 'context_available': True}, {'type': 'invented_method', 'detail': ""Method 'sanic_json' not found in sanic API"", 'call': 'sanic_json', 'context_available': True}, {'type': 'invented_method', 'detail': ""Method 'sanic_json' not found in sanic API"", 'call': 'sanic_json', 'context_available': True}, {'type': 'invented_method', 'detail': ""Method 'sanic_json' not found in sanic API"", 'call': 'sani",,1.0,0.00,0,,,,"Create a Sanic web application with blueprints, streaming, and signal-based middleware",0,e71e05d58497,,0,53a59977b69c
hallucination,context7,"[{'type': 'invented_method', 'detail': ""Method 'falcon.HTTPUnauthorized' not found in falcon API"", 'call': 'falcon.HTTPUnauthorized', 'context_available': True}, {'type': 'invented_method', 'detail': ""Method 'falcon.HTTPForbidden' not found in falcon API"", 'call': 'falcon.HTTPForbidden', 'context_available': True}]",,1.0,0.00,0,,,,"Build a Falcon REST API with middleware, hooks, responders, and ASGI support",0,e71e05d58497,,0,a2981dedd22b
hallucination,context7,"[{'type': 'wrong_parameter', 'detail': ""Parameter 'shape' not valid for tf.function()"", 'call': 'tf.function', 'parameter': 'shape', 'context_available': True}, {'type': 'wrong_parameter', 'detail': ""Parameter 'dtype' not valid for tf.function()"", 'call': 'tf.function', 'parameter': 'dtype', 'context_available': True}]",,1.0,0.00,0,,,,"Implement a TensorFlow 2.x model with tf.data pipeline, custom training, and SavedModel export",0,e71e05d58497,,0,8c922cc174c5
hallucination,context7,,,0.0,0.00,0,,,,"Create a Dask distributed computation with delayed functions, DataFrames, and cluster management",0,e71e05d58497,,0,943deaedceda
hallucination,context7,,,0.0,0.00,0,,,,"Build a Tortoise ORM application with models, relations, and async query building",0,e71e05d58497,,0,605bea00118a
hallucination,context7,,,0.0,0.00,0,,,,"Implement a Peewee ORM application with model definitions, joins, and transaction management",0,e71e05d58497,,0,185189ed1cea
hallucination,context7,"[{'type': 'wrong_parameter', 'detail': ""Parameter 'dict' not valid for get()"", 'call': 'get', 'parameter': 'dict', 'context_available': True}]",,1.0,0.00,0,,,,"Set up a requests-based HTTP client with session management, authentication, and streaming",0,e71e05d58497,,0,d9740aa7104a
hallucination,context7,"[{'type': 'invented_method', 'detail': ""Method 'create_urllib3_context' not found in urllib3 API"", 'call': 'create_urllib3_context', 'context_available': True}, {'type': 'wrong_parameter', 'detail': ""Parameter 'raise_on_redirect' not valid for Retry()"", 'call': 'Retry', 'parameter': 'raise_on_redirect', 'context_available': True}, {'type': 'wrong_parameter', 'detail': ""Parameter 'respect_retry_after_header' not valid for Retry()"", 'call': 'Retry', 'parameter': 'respect_retry_after_header', 'cont",,1.0,0.00,0,,,,"Build a urllib3 connection pool with retries, TLS configuration, and proxy support",0,e71e05d58497,,0,8088ec60cd67
hallucination,context7,"[{'type': 'invented_method', 'detail': ""Method 'login' not found in gin API"", 'call': 'login', 'context_available': True}]",,1.0,0.00,0,,,,"Implement a Gin web server with route groups, middleware, validation, and custom error handling in Go",0,e71e05d58497,,0,a5e56950478e
hallucination,context7,,,0.0,0.00,0,,,,"Build an Echo web application with middleware, request binding, and response rendering in Go",0,e71e05d58497,,0,1200c45c26e8
hallucination,context7,,,0.0,0.00,0,,,,"Implement a GORM database layer with models, associations, hooks, and scoped queries in Go",0,e71e05d58497,,0,7e40104cfc79
hallucination,context7,,,0.0,0.00,0,,,,"Build an Actix-web server with extractors, middleware, state management, and error handling in Rust",0,e71e05d58497,,0,288a646f755c
hallucination,context7,,,0.0,0.00,0,,,,"Implement a Tokio async runtime with channels, select, timers, and spawned tasks in Rust",0,e71e05d58497,,0,1917ae1923fc
hallucination,context7,"[{'type': 'invented_method', 'detail': ""Method 'serde' not found in serde API"", 'call': 'serde', 'context_available': True}, {'type': 'invented_method', 'detail': ""Method 'serde' not found in serde API"", 'call': 'serde', 'context_available': True}, {'type': 'invented_method', 'detail': ""Method 'serde' not found in serde API"", 'call': 'serde', 'context_available': True}, {'type': 'invented_method', 'detail': ""Method 'serde' not found in serde API"", 'call': 'serde', 'context_available': True}, {'t",,1.0,0.00,0,,,,"Build a Serde serialization layer with custom derive, field attributes, and format support in Rust",0,e71e05d58497,,0,f570c7430e35
hallucination,context7,,,0.0,0.00,0,,,,"Implement a Django REST Framework API with serializers, viewsets, permissions, and pagination",0,e71e05d58497,,0,eeed32959e78
hallucination,context7,,,0.0,0.00,0,,,,"Create a Dramatiq task queue with actors, middleware, results backend, and rate limiting",0,e71e05d58497,,0,0e4e12b68f4f
hallucination,context7,,,0.0,0.00,0,,,,"Build an RQ (Redis Queue) worker setup with job scheduling, failure handling, and monitoring",0,e71e05d58497,,0,73f7e0626ffe
hallucination,context7,,,0.0,0.00,0,,,,"Set up a Django 5 model layer with custom managers, querysets, signals, and migration operations",0,e71e05d58497,,0,4c446de7de88
hallucination,context7,,,0.0,0.00,0,,,,"Build a multi-step LangChain agent with tool calling, memory, and structured output",0,e71e05d58497,,0,519535c95888
hallucination,context7,,,0.0,0.00,0,,,,"Create a FastAPI application with OAuth2 authentication, dependency injection, and background tasks",0,e71e05d58497,,0,27464c0cf0e7
hallucination,context7,"[{'type': 'invented_method', 'detail': ""Method 'AppSettings' not found in pydantic-settings API"", 'call': 'AppSettings', 'context_available': True}, {'type': 'invented_method', 'detail': ""Method 'create_settings_from_env' not found in pydantic-settings API"", 'call': 'create_settings_from_env', 'context_available': True}, {'type': 'invented_method', 'detail': ""Method 'AppSettings' not found in pydantic-settings API"", 'call': 'AppSettings', 'context_available': True}, {'type': 'invented_method', '",,1.0,0.00,0,,,,Implement a complex Pydantic v2 settings management with environment variable parsing and nested configs,0,e71e05d58497,,0,97f1fee8289e
hallucination,context7,"[{'type': 'invented_method', 'detail': ""Method 'LightningClassifier' not found in pytorch-lightning API"", 'call': 'LightningClassifier', 'context_available': True}, {'type': 'invented_method', 'detail': ""Method 'run_lightning_training' not found in pytorch-lightning API"", 'call': 'run_lightning_training', 'context_available': True}, {'type': 'invented_method', 'detail': ""Method 'LightningClassifier' not found in pytorch-lightning API"", 'call': 'LightningClassifier', 'context_available': True}]",,1.0,0.00,0,,,,"Build a PyTorch Lightning training module with callbacks, logging, and distributed training",0,e71e05d58497,,0,762958b54d77
hallucination,context7,"[{'type': 'invented_method', 'detail': ""Method 'Next.js' not found in next API"", 'call': 'Next.js', 'context_available': True}]",,1.0,0.00,0,,,,"Build a Next.js API route handler with middleware, streaming responses, and server actions",0,e71e05d58497,,0,2234b5af8223
hallucination,context7,"[{'type': 'invented_method', 'detail': ""Method 'pytest.mark.parametrize' not found in pytest API"", 'call': 'pytest.mark.parametrize', 'context_available': True}, {'type': 'invented_method', 'detail': ""Method 'pytest.mark.parametrize' not found in pytest API"", 'call': 'pytest.mark.parametrize', 'context_available': True}, {'type': 'invented_method', 'detail': ""Method 'pytest.mark.parametrize' not found in pytest API"", 'call': 'pytest.mark.parametrize', 'context_available': True}]",,1.0,0.00,0,,,,"Create a comprehensive test suite with pytest including fixtures, parametrize, mocking, and async tests",0,e71e05d58497,,0,a8050d09367b
