benchmark_type,engine,error,error_category,hallucination_rate,latency_ms,num_results,primary_language,primary_repo,query_id,query_text,relevant_tokens_returned,run_id,token_efficiency,total_tokens_returned,trace_id
hallucination,context7,"[{'type': 'invented_method', 'detail': ""Method 'write_mypy_ini' not found in mypy API"", 'call': 'write_mypy_ini', 'context_available': True}, {'type': 'invented_method', 'detail': ""Method 'mypy_config.items' not found in mypy API"", 'call': 'mypy_config.items', 'context_available': True}, {'type': 'invented_method', 'detail': ""Method 'run_mypy' not found in mypy API"", 'call': 'run_mypy', 'context_available': True}, {'type': 'invented_method', 'detail': ""Method 'mypy' not found in mypy API"", 'call",,1.0,0.00,0,,,,"Set up a comprehensive mypy type checking configuration with plugins, overrides, and strict mode",0,e71e05d58497,,0,9c60e095d562
hallucination,context7,,,0.0,0.00,0,,,,"Build a SQLAlchemy 2.0 model with hybrid properties, custom types, and event listeners",0,e71e05d58497,,0,fdc30a653b8f
hallucination,context7,"[{'type': 'invented_method', 'detail': ""Method 'create_docker_compose_script' not found in docker-compose API"", 'call': 'create_docker_compose_script', 'context_available': True}, {'type': 'invented_method', 'detail': ""Method 'generate_dockerfile' not found in docker-compose API"", 'call': 'generate_dockerfile', 'context_available': True}, {'type': 'invented_method', 'detail': ""Method 'dockerfiles.get' not found in docker-compose API"", 'call': 'dockerfiles.get', 'context_available': True}, {'type",,1.0,0.00,0,,,,"Implement a complete Docker Compose setup with multi-stage builds, health checks, and network configuration",0,e71e05d58497,,0,84f4016f3230
hallucination,context7,,,0.0,0.00,0,,,,"Create a Kubernetes deployment manifest with rolling updates, resource limits, probes, and autoscaling",0,e71e05d58497,,0,346ed6534740
hallucination,context7,"[{'type': 'invented_method', 'detail': ""Method 'generate_webpack_config' not found in webpack API"", 'call': 'generate_webpack_config', 'context_available': True}]",,1.0,0.00,0,,,,"Build a Webpack 5 configuration with code splitting, module federation, and asset optimization",0,e71e05d58497,,0,b2159b369134
hallucination,context7,"[{'type': 'wrong_parameter', 'detail': ""Parameter 'lw' not valid for plot()"", 'call': 'plot', 'parameter': 'lw', 'context_available': True}, {'type': 'wrong_parameter', 'detail': ""Parameter 'lw' not valid for plot()"", 'call': 'plot', 'parameter': 'lw', 'context_available': True}, {'type': 'wrong_parameter', 'detail': ""Parameter 'lw' not valid for plot()"", 'call': 'plot', 'parameter': 'lw', 'context_available': True}, {'type': 'wrong_parameter', 'detail': ""Parameter 'lw' not valid for plot()"", 'c",,1.0,0.00,0,,,,"Create a Matplotlib visualization with subplots, custom styling, annotations, and interactive features",0,e71e05d58497,,0,91166fe2f479
hallucination,context7,,,0.0,0.00,0,,,,"Build a Plotly interactive dashboard with subplots, animations, and custom themes",0,e71e05d58497,,0,3a6f76307734
hallucination,context7,,,0.0,0.00,0,,,,"Create a Seaborn statistical visualization with faceted plots, regression, and custom palettes",0,e71e05d58497,,0,eb03d0352f11
hallucination,context7,"[{'type': 'invented_method', 'detail': ""Method 'create_celery_app' not found in celery API"", 'call': 'create_celery_app', 'context_available': True}, {'type': 'invented_method', 'detail': ""Method 'create_celery_app' not found in celery API"", 'call': 'create_celery_app', 'context_available': True}]",,1.0,0.00,0,,,,Implement a Celery beat scheduler with timezone-aware periodic tasks and dynamic scheduling,0,e71e05d58497,,0,9f9a031cfd1c
hallucination,context7,"[{'type': 'wrong_parameter', 'detail': ""Parameter 'url' not valid for context.configure()"", 'call': 'context.configure', 'parameter': 'url', 'context_available': True}, {'type': 'wrong_parameter', 'detail': ""Parameter 'literal_binds' not valid for context.configure()"", 'call': 'context.configure', 'parameter': 'literal_binds', 'context_available': True}, {'type': 'wrong_parameter', 'detail': ""Parameter 'dialect_opts' not valid for context.configure()"", 'call': 'context.configure', 'parameter': '",,1.0,0.00,0,,,,"Build a comprehensive Alembic migration setup with auto-generation, batch operations, and data migrations",0,e71e05d58497,,0,17177e6c0543
hallucination,context7,,,0.0,0.00,0,,,,"Implement a Marshmallow schema with nested objects, custom fields, and two-way serialization",0,e71e05d58497,,0,081483f80449
hallucination,context7,,,0.0,0.00,0,,,,"Create a comprehensive AWS Boto3 setup for S3 operations with presigned URLs, multipart upload, and lifecycle rules",0,e71e05d58497,,0,6c75a8bb5330
hallucination,context7,"[{'type': 'wrong_parameter', 'detail': ""Parameter 'filter' not valid for where()"", 'call': 'where', 'parameter': 'filter', 'context_available': True}, {'type': 'wrong_parameter', 'detail': ""Parameter 'filter' not valid for where()"", 'call': 'where', 'parameter': 'filter', 'context_available': True}]",,1.0,0.00,0,,,,"Implement Google Cloud Firestore operations with transactions, batch writes, and real-time listeners",0,e71e05d58497,,0,626b283339ba
hallucination,context7,"[{'type': 'invented_method', 'detail': ""Method 'Celery' not found in celery API"", 'call': 'Celery', 'context_available': True}]",,1.0,0.00,0,,,,"Build a Celery task with custom serializers, priority queues, and canvas workflows",0,e71e05d58497,,0,fb399cea59e6
hallucination,context7,,,0.0,0.00,0,,,,"Create an OpenAI API integration with chat completions, function calling, streaming, and embeddings",0,e71e05d58497,,0,6d33090d9f2b
hallucination,context7,,,0.0,0.00,0,,,,"Build a Anthropic Claude integration with streaming, tool use, and multi-turn conversations",0,e71e05d58497,,0,fbc1861fea7e
hallucination,context7,"[{'type': 'invented_method', 'detail': ""Method 'get_supabase_client' not found in supabase API"", 'call': 'get_supabase_client', 'context_available': True}, {'type': 'invented_method', 'detail': ""Method 'get_supabase_client' not found in supabase API"", 'call': 'get_supabase_client', 'context_available': True}, {'type': 'invented_method', 'detail': ""Method 'get_supabase_client' not found in supabase API"", 'call': 'get_supabase_client', 'context_available': True}, {'type': 'wrong_parameter', 'detai",,1.0,0.00,0,,,,"Implement a Supabase backend with auth, real-time subscriptions, storage, and edge functions",0,e71e05d58497,,0,4b22354b1765
hallucination,context7,,,0.0,0.00,0,,,,"Build a comprehensive GitHub Actions workflow with matrix strategy, caching, artifacts, and reusable workflows",0,e71e05d58497,,0,9ebf57df32e4
hallucination,context7,"[{'type': 'invented_method', 'detail': ""Method 'create_terraform_project' not found in terraform API"", 'call': 'create_terraform_project', 'context_available': True}]",,1.0,0.00,0,,,,"Create a Terraform infrastructure configuration with modules, state management, and provider configuration",0,e71e05d58497,,0,f338464f99db
hallucination,context7,,,0.0,0.00,0,,,,"Implement a Svelte 5 component with runes, snippets, and fine-grained reactivity",0,e71e05d58497,,0,43111a2775bc
hallucination,context7,,,0.0,0.00,0,,,,"Build a Vue 3 application with Composition API, Pinia store, and Vue Router 4",0,e71e05d58497,,0,a3fe578e65c6
hallucination,context7,,,0.0,0.00,0,,,,"Create an Angular 17 application with signals, standalone components, and new control flow",0,e71e05d58497,,0,ca6e46debb0f
hallucination,context7,,,0.0,0.00,0,,,,"Build a GraphQL API with Strawberry framework including subscriptions, dataloaders, and authentication",0,e71e05d58497,,0,24e399a1fbe7
hallucination,context7,,,0.0,0.00,0,,,,"Create a comprehensive Pillow image processing pipeline with filters, compositing, and format conversion",0,e71e05d58497,,0,c259e41928f0
hallucination,context7,,,0.0,0.00,0,,,,Implement a comprehensive Arrow/Parquet data pipeline with PyArrow for columnar data processing,0,e71e05d58497,,0,67c74433a4fc
hallucination,context7,,,0.0,0.00,0,,,,"Build a comprehensive cryptography setup with Fernet encryption, RSA key pairs, and certificate generation",0,e71e05d58497,,0,8b41ba029f63
hallucination,context7,,,0.0,0.00,0,,,,"Create an Elasticsearch query with aggregations, highlighting, and suggesters using elasticsearch-py",0,e71e05d58497,,0,4bc91a2937a2
hallucination,context7,,,0.0,0.00,0,,,,"Implement a comprehensive GraphQL server with Ariadne including schema-first design, subscriptions, and uploads",0,e71e05d58497,,0,b29d998c93c1
hallucination,context7,,,0.0,0.00,0,,,,"Build a comprehensive Airflow DAG with task dependencies, sensors, hooks, and dynamic task mapping",0,e71e05d58497,,0,cbaf274c934f
hallucination,context7,,,0.0,0.00,0,,,,"Create a comprehensive Prefect 2 flow with tasks, retries, caching, and deployment configuration",0,e71e05d58497,,0,ccd1340847a9
hallucination,context7,"[{'type': 'invented_method', 'detail': ""Method 'grpc.unary_unary_rpc_method_handler' not found in grpc API"", 'call': 'grpc.unary_unary_rpc_method_handler', 'context_available': True}, {'type': 'invented_method', 'detail': ""Method 'grpc.unary_unary_rpc_method_handler' not found in grpc API"", 'call': 'grpc.unary_unary_rpc_method_handler', 'context_available': True}]",,1.0,0.00,0,,,,"Implement a comprehensive gRPC service with protobuf, streaming, interceptors, and health checks in Python",0,e71e05d58497,,0,d11db22a3451
hallucination,context7,"[{'type': 'wrong_parameter', 'detail': ""Parameter 'username' not valid for WebSocket()"", 'call': 'WebSocket', 'parameter': 'username', 'context_available': True}]",,1.0,0.00,0,,,,"Build a FastAPI WebSocket server with connection management, broadcasting, and heartbeat",0,e71e05d58497,,0,73a6470eeadd
hallucination,context7,"[{'type': 'invented_method', 'detail': ""Method 'SQLModel.metadata.create_all' not found in sqlmodel API"", 'call': 'SQLModel.metadata.create_all', 'context_available': True}]",,1.0,0.00,0,,,,"Create a SQLModel application with models, relationships, and async database operations",0,e71e05d58497,,0,0a149db67b33
hallucination,context7,"[{'type': 'invented_method', 'detail': ""Method 'create_tauri_app' not found in tauri API"", 'call': 'create_tauri_app', 'context_available': True}]",,1.0,0.00,0,,,,"Build a Tauri desktop application with commands, state management, and event system using Rust backend",0,e71e05d58497,,0,d0d0500266f3
hallucination,context7,,,0.0,0.00,0,,,,"Implement a comprehensive Pytest-BDD test suite with scenarios, step definitions, and fixtures",0,e71e05d58497,,0,1a81fa139647
hallucination,context7,"[{'type': 'wrong_parameter', 'detail': ""Parameter 'output_type' not valid for Agent()"", 'call': 'Agent', 'parameter': 'output_type', 'context_available': True}, {'type': 'wrong_parameter', 'detail': ""Parameter 'validation_context' not valid for Agent()"", 'call': 'Agent', 'parameter': 'validation_context', 'context_available': True}]",,1.0,0.00,0,,,,"Create a Pydantic AI agent with tool definitions, structured output, and retry handling",0,e71e05d58497,,0,761f37e479e2
hallucination,context7,"[{'type': 'invented_method', 'detail': ""Method 'MatchResult' not found in re API"", 'call': 'MatchResult', 'context_available': True}, {'type': 'invented_method', 'detail': ""Method 'MatchResult' not found in re API"", 'call': 'MatchResult', 'context_available': True}, {'type': 'invented_method', 'detail': ""Method 'MatchResult' not found in re API"", 'call': 'MatchResult', 'context_available': True}, {'type': 'invented_method', 'detail': ""Method 'self.results.append' not found in re API"", 'call': 's",,1.0,0.00,0,,,,"Build a comprehensive Regex pattern matching pipeline with named groups, lookahead, and Unicode support",0,e71e05d58497,,0,2db3d4a7f4cd
hallucination,context7,,,0.0,0.00,0,,,,"Create a Pydantic dataclass with field aliases, discriminated unions, and custom JSON encoders",0,e71e05d58497,,0,f8580ce8b906
hallucination,context7,"[{'type': 'invented_method', 'detail': ""Method 'htmx_event_fragment' not found in django-htmx API"", 'call': 'htmx_event_fragment', 'context_available': True}]",,1.0,0.00,0,,,,Implement a complete HTMX-powered Django application with server-sent events and WebSocket fallback,0,e71e05d58497,,0,8f37b03b2299
hallucination,context7,,,0.0,0.00,0,,,,"Build a Neon serverless Postgres application with connection pooling, branching, and edge functions",0,e71e05d58497,,0,4151a5bdfdcf
hallucination,context7,,,0.0,0.00,0,,,,"Create a comprehensive tRPC API with routers, middleware, subscriptions, and React integration",0,e71e05d58497,,0,369e7c4b7cf0
hallucination,synsc-context,,,0.0,0.00,0,,,,Create a FastAPI endpoint that accepts a JSON body with nested Pydantic models and returns a validated response,0,b29a435e2d3d,,0,24df3c9b7579
hallucination,synsc-context,,,0.0,0.00,0,,,,"Set up an async HTTPX client with custom timeout, retry logic, and connection pooling",0,b29a435e2d3d,,0,0c34dc104db6
hallucination,synsc-context,"[{'type': 'outdated_api', 'detail': ""'field_validator' uses deprecated API 'validator'"", 'call': 'field_validator', 'context_available': True}, {'type': 'outdated_api', 'detail': ""'field_validator' uses deprecated API 'validator'"", 'call': 'field_validator', 'context_available': True}, {'type': 'outdated_api', 'detail': ""'field_validator' uses deprecated API 'validator'"", 'call': 'field_validator', 'context_available': True}, {'type': 'outdated_api', 'detail': ""'field_validator' uses deprecated ",,1.0,0.00,0,,,,"Define a Pydantic v2 model with custom validators, computed fields, and JSON schema customization",0,b29a435e2d3d,,0,7a0c4648f539
hallucination,synsc-context,,,0.0,0.00,0,,,,Implement SQLAlchemy 2.0 async session with select statements and relationship loading,0,b29a435e2d3d,,0,33f4896212b4
hallucination,synsc-context,"[{'type': 'invented_method', 'detail': ""Method 'click.BadParameter' not found in click API"", 'call': 'click.BadParameter', 'context_available': True}, {'type': 'invented_method', 'detail': ""Method 'click.BadParameter' not found in click API"", 'call': 'click.BadParameter', 'context_available': True}, {'type': 'invented_method', 'detail': ""Method 'click.version_option' not found in click API"", 'call': 'click.version_option', 'context_available': True}, {'type': 'invented_method', 'detail': ""Method",,1.0,0.00,0,,,,"Create a Click CLI application with nested command groups, options with validation, and rich help text",0,b29a435e2d3d,,0,99ef08e47def
hallucination,synsc-context,"[{'type': 'wrong_parameter', 'detail': ""Parameter 'add_start_index' not valid for RecursiveCharacterTextSplitter()"", 'call': 'RecursiveCharacterTextSplitter', 'parameter': 'add_start_index', 'context_available': True}]",,1.0,0.00,0,,,,"Build a LangChain RAG pipeline with document loading, text splitting, vector store, and retrieval chain",0,b29a435e2d3d,,0,f1de6d5f9947
hallucination,synsc-context,,,0.0,0.00,0,,,,"Implement a PyTorch training loop with mixed precision, gradient accumulation, and learning rate scheduling",0,b29a435e2d3d,,0,eb9ce5c67728
hallucination,synsc-context,"[{'type': 'invented_method', 'detail': ""Method 'stripe.checkout.Session.create' not found in stripe API"", 'call': 'stripe.checkout.Session.create', 'context_available': True}, {'type': 'invented_method', 'detail': ""Method 'stripe.checkout.Session.retrieve' not found in stripe API"", 'call': 'stripe.checkout.Session.retrieve', 'context_available': True}, {'type': 'invented_method', 'detail': ""Method 'stripe.Customer.create' not found in stripe API"", 'call': 'stripe.Customer.create', 'context_avail",,1.0,0.00,0,,,,"Create a Stripe payment integration with checkout sessions, webhooks, and subscription management",0,b29a435e2d3d,,0,bd36c68ec9c9
hallucination,synsc-context,,,0.0,0.00,0,,,,"Build a Next.js App Router page with server components, data fetching, and loading states",0,b29a435e2d3d,,0,7f6fa3f09e76
hallucination,synsc-context,,,0.0,0.00,0,,,,"Set up a Tailwind CSS v4 configuration with custom theme, plugins, and dark mode",0,b29a435e2d3d,,0,096de2e01c6e
hallucination,synsc-context,,,0.0,0.00,0,,,,"Build a Django 5 REST API with class-based views, custom permissions, and queryset filtering",0,b29a435e2d3d,,0,7462a8ba6a3c
hallucination,synsc-context,,,0.0,0.00,0,,,,"Create a Flask application with Blueprints, custom error handlers, and SQLAlchemy integration",0,b29a435e2d3d,,0,132835028755
hallucination,synsc-context,,,0.0,0.00,0,,,,"Implement a pandas DataFrame pipeline with method chaining, window functions, and categorical data handling",0,b29a435e2d3d,,0,b9f0842644dc
hallucination,synsc-context,,,0.0,0.00,0,,,,"Build a NumPy computation pipeline with broadcasting, structured arrays, and random number generation",0,b29a435e2d3d,,0,3f97a341fcc4
hallucination,synsc-context,"[{'type': 'invented_method', 'detail': ""Method 'scipy_optimization_with_constraints' not found in scipy API"", 'call': 'scipy_optimization_with_constraints', 'context_available': True}, {'type': 'invented_method', 'detail': ""Method 'scipy_curve_fitting' not found in scipy API"", 'call': 'scipy_curve_fitting', 'context_available': True}, {'type': 'invented_method', 'detail': ""Method 'scipy.sparse.coo_matrix' not found in scipy API"", 'call': 'scipy.sparse.coo_matrix', 'context_available': True}]",,1.0,0.00,0,,,,"Perform SciPy optimization with constraints, curve fitting, and sparse matrix operations",0,b29a435e2d3d,,0,7cdf767e3332
hallucination,synsc-context,,,0.0,0.00,0,,,,"Build a Polars data pipeline with lazy frames, window functions, and expression API",0,b29a435e2d3d,,0,4cef668c8fc8
hallucination,synsc-context,,,0.0,0.00,0,,,,"Train a scikit-learn pipeline with custom transformers, cross-validation, and hyperparameter search",0,b29a435e2d3d,,0,4b6b1fc312b5
hallucination,synsc-context,"[{'type': 'wrong_parameter', 'detail': ""Parameter 'warmup_ratio' not valid for TrainingArguments()"", 'call': 'TrainingArguments', 'parameter': 'warmup_ratio', 'context_available': True}, {'type': 'wrong_parameter', 'detail': ""Parameter 'metric_for_best_model' not valid for TrainingArguments()"", 'call': 'TrainingArguments', 'parameter': 'metric_for_best_model', 'context_available': True}, {'type': 'wrong_parameter', 'detail': ""Parameter 'greater_is_better' not valid for TrainingArguments()"", 'cal",,1.0,0.00,0,,,,"Fine-tune a HuggingFace Transformers model with the Trainer API, custom data collator, and evaluation metrics",0,b29a435e2d3d,,0,ec18462473cc
hallucination,synsc-context,"[{'type': 'invented_method', 'detail': ""Method 'keras.metrics.Mean' not found in keras API"", 'call': 'keras.metrics.Mean', 'context_available': True}, {'type': 'invented_method', 'detail': ""Method 'keras.metrics.BinaryAccuracy' not found in keras API"", 'call': 'keras.metrics.BinaryAccuracy', 'context_available': True}, {'type': 'invented_method', 'detail': ""Method 'keras.metrics.AUC' not found in keras API"", 'call': 'keras.metrics.AUC', 'context_available': True}, {'type': 'invented_method', 'de",,1.0,0.00,0,,,,"Create a Keras 3 model with functional API, custom training step, and multi-backend support",0,b29a435e2d3d,,0,53dd8d6a3324
hallucination,synsc-context,"[{'type': 'invented_method', 'detail': ""Method 'asyncio_timeout' not found in asyncio API"", 'call': 'asyncio_timeout', 'context_available': True}, {'type': 'invented_method', 'detail': ""Method 'asyncio.ensure_future' not found in asyncio API"", 'call': 'asyncio.ensure_future', 'context_available': True}, {'type': 'outdated_api', 'detail': ""'asyncio.ensure_future' uses deprecated API 'ensure_future'"", 'call': 'asyncio.ensure_future', 'context_available': True}, {'type': 'invented_method', 'detail'",,1.0,0.00,0,,,,"Implement asyncio concurrent tasks with structured concurrency, timeout handling, and cancellation",0,b29a435e2d3d,,0,8aa966ce01d5
hallucination,synsc-context,,,0.0,0.00,0,,,,"Set up a Celery task queue with periodic tasks, result backends, retry policies, and task chaining",0,b29a435e2d3d,,0,e24015c39f90
hallucination,synsc-context,"[{'type': 'invented_method', 'detail': ""Method 'redis.call' not found in redis-py API"", 'call': 'redis.call', 'context_available': True}, {'type': 'invented_method', 'detail': ""Method 'redis.call' not found in redis-py API"", 'call': 'redis.call', 'context_available': True}, {'type': 'invented_method', 'detail': ""Method 'redis.call' not found in redis-py API"", 'call': 'redis.call', 'context_available': True}, {'type': 'invented_method', 'detail': ""Method 'redis.call' not found in redis-py API"", '",,1.0,0.00,0,,,,"Build a Redis cache layer with pipelining, pub/sub messaging, and Lua scripting using redis-py",0,b29a435e2d3d,,0,f928b305d091
hallucination,synsc-context,,,0.0,0.00,0,,,,"Implement a PyMongo aggregation pipeline with lookup, group, faceted search, and change streams",0,b29a435e2d3d,,0,af6ba41e6796
hallucination,synsc-context,"[{'type': 'invented_method', 'detail': ""Method 'app.add_typer' not found in typer API"", 'call': 'app.add_typer', 'context_available': True}, {'type': 'invented_method', 'detail': ""Method 'app.add_typer' not found in typer API"", 'call': 'app.add_typer', 'context_available': True}, {'type': 'invented_method', 'detail': ""Method 'app.add_typer' not found in typer API"", 'call': 'app.add_typer', 'context_available': True}]",,1.0,0.00,0,,,,"Create a Typer CLI application with subcommands, rich help panels, and automatic shell completion",0,b29a435e2d3d,,0,eaad76179f06
hallucination,synsc-context,"[{'type': 'wrong_parameter', 'detail': ""Parameter 'header_style' not valid for Table()"", 'call': 'Table', 'parameter': 'header_style', 'context_available': True}, {'type': 'wrong_parameter', 'detail': ""Parameter 'border_style' not valid for Table()"", 'call': 'Table', 'parameter': 'border_style', 'context_available': True}, {'type': 'wrong_parameter', 'detail': ""Parameter 'row_styles' not valid for Table()"", 'call': 'Table', 'parameter': 'row_styles', 'context_available': True}, {'type': 'wrong_p",,1.0,0.00,0,,,,"Build a Rich terminal UI with live display, tables, progress bars, and tree views",0,b29a435e2d3d,,0,ff24fd7d9e2f
hallucination,synsc-context,"[{'type': 'invented_method', 'detail': ""Method 'setup_structlog' not found in structlog API"", 'call': 'setup_structlog', 'context_available': True}, {'type': 'invented_method', 'detail': ""Method 'structlog.stdlib.PositionalArgumentsFormatter' not found in structlog API"", 'call': 'structlog.stdlib.PositionalArgumentsFormatter', 'context_available': True}, {'type': 'invented_method', 'detail': ""Method 'structlog.processors.TimeStamper' not found in structlog API"", 'call': 'structlog.processors.Tim",,1.0,0.00,0,,,,"Set up structured logging with structlog including processors, formatters, and context binding",0,b29a435e2d3d,,0,e7efaa5e1bb3
hallucination,synsc-context,,,0.0,0.00,0,,,,"Create a Loguru logging setup with rotation, serialization, custom sinks, and structured output",0,b29a435e2d3d,,0,403458d87d28
hallucination,synsc-context,,,0.0,0.00,0,,,,"Build a React 19 application with server components, use hook, and concurrent features",0,b29a435e2d3d,,0,edb9de8e0113
hallucination,synsc-context,,,0.0,0.00,0,,,,"Implement an Express.js REST API with middleware chain, error handling, and route organization",0,b29a435e2d3d,,0,7f3a0aca43b3
hallucination,synsc-context,"[{'type': 'invented_method', 'detail': ""Method 'Prisma' not found in prisma API"", 'call': 'Prisma', 'context_available': True}]",,1.0,0.00,0,,,,"Create a Prisma schema with relations, middleware, and complex queries using the client",0,b29a435e2d3d,,0,47a659564320
hallucination,synsc-context,,,0.0,0.00,0,,,,"Build a Zod schema with complex validation, transforms, and type inference for a TypeScript API",0,b29a435e2d3d,,0,c450105444ad
hallucination,synsc-context,"[{'type': 'invented_method', 'detail': ""Method 'QueryState' not found in tanstack-query API"", 'call': 'QueryState', 'context_available': True}, {'type': 'invented_method', 'detail': ""Method 'query_fn' not found in tanstack-query API"", 'call': 'query_fn', 'context_available': True}, {'type': 'invented_method', 'detail': ""Method 'QueryState' not found in tanstack-query API"", 'call': 'QueryState', 'context_available': True}, {'type': 'invented_method', 'detail': ""Method 'query_fn' not found in tans",,1.0,0.00,0,,,,"Implement TanStack Query v5 with mutations, optimistic updates, and infinite scroll pagination",0,b29a435e2d3d,,0,eab905a57560
hallucination,synsc-context,,,0.0,0.00,0,,,,"Build a Starlette ASGI application with WebSocket support, middleware, and background tasks",0,b29a435e2d3d,,0,c678cefe295a
hallucination,synsc-context,,,0.0,0.00,0,,,,"Create an aiohttp web server with WebSocket support, sessions, and middleware",0,b29a435e2d3d,,0,0a330275328f
hallucination,synsc-context,"[{'type': 'invented_method', 'detail': ""Method 'tornado.web.HTTPError' not found in tornado API"", 'call': 'tornado.web.HTTPError', 'context_available': True}, {'type': 'invented_method', 'detail': ""Method 'tornado.web.HTTPError' not found in tornado API"", 'call': 'tornado.web.HTTPError', 'context_available': True}, {'type': 'invented_method', 'detail': ""Method 'tornado.web.HTTPError' not found in tornado API"", 'call': 'tornado.web.HTTPError', 'context_available': True}, {'type': 'invented_method",,1.0,0.00,0,,,,"Build a Tornado web application with async request handlers, WebSockets, and coroutine patterns",0,b29a435e2d3d,,0,92598e7aef70
hallucination,synsc-context,"[{'type': 'invented_method', 'detail': ""Method 'SanicException' not found in sanic API"", 'call': 'SanicException', 'context_available': True}]",,1.0,0.00,0,,,,"Create a Sanic web application with blueprints, streaming, and signal-based middleware",0,b29a435e2d3d,,0,81c67d432ba4
